title_id,peak_position,song_key,year,since 2000,cut_two,songwriter_gender,song writer count,count of women,cut,has no women,has no men,artist_gender
401350,3,All Or Nothing by O-Town,2001,1,only men,"['m', 'm']",2,0,no women,only men,1 or more men,m
402234,1,"Lady Marmalade by Christina Aguilera, Lil' Kim, Mya & P!nk",2001,1,only men,"['m', 'm']",2,0,no women,only men,1 or more men,f
405509,4,Differences by Ginuwine,2001,1,only men,"['m', 'm']",2,0,no women,only men,1 or more men,m;f
406551,1,How You Remind Me by Nickelback,2001,1,only men,"['m', 'm']",2,0,no women,only men,1 or more men,m
389643,5,If You're Gone by matchbox twenty,2001,1,only men,['m'],1,0,no women,only men,1 or more men,m
393911,2,Hanging By A Moment by Lifehouse,2001,1,only men,['m'],1,0,no women,only men,1 or more men,m
394188,4,Again by Lenny Kravitz,2001,1,only men,['m'],1,0,no women,only men,1 or more men,m
399979,5,Drops Of Jupiter (Tell Me) by Train,2001,1,only men,['m'],1,0,no women,only men,1 or more men,m
402013,5,It's Been Awhile by Staind,2001,1,only men,['m'],1,0,no women,only men,1 or more men,m
402027,2,Hit 'Em Up Style (Oops!) by Blu Cantrell,2001,1,only men,['m'],1,0,no women,only men,1 or more men,f
401303,1,All For You by Janet,2001,1,"mixed, majority men","['f', 'm', 'm', 'm', 'm', 'm']",6,1,at least 1 woman,1 or more women in credits,1 or more men,f
403049,3,Someone To Call My Lover by Janet,2001,1,"mixed, majority men","['f', 'm', 'm', 'm']",4,1,at least 1 woman,1 or more women in credits,1 or more men,f
394439,4,Don't Tell Me by Madonna,2001,1,"mixed, majority men","['f', 'm', 'm']",3,1,at least 1 woman,1 or more women in credits,1 or more men,f
400657,2,Survivor by Destiny's Child,2001,1,"mixed, majority men","['f', 'm', 'm']",3,1,at least 1 woman,1 or more women in credits,1 or more men,f
393213,3,Thank You by Dido,2001,1,parity,"['f', 'm']",2,1,at least 1 woman,1 or more women in credits,1 or more men,f
404074,1,U Remind Me by Usher,2001,1,parity,"['f', 'm']",2,1,at least 1 woman,1 or more women in credits,1 or more men,m
393130,3,Ride Wit Me by Nelly Featuring City Spud,2001,1,"mixed, majority men","['m', 'f', 'm', 'm', 'm']",5,1,at least 1 woman,1 or more women in credits,1 or more men,m
401358,2,Let Me Blow Ya Mind by Eve Featuring Gwen Stefani,2001,1,"mixed, majority men","['m', 'm', 'f', 'm', 'm']",5,1,at least 1 woman,1 or more women in credits,1 or more men,f
406073,2,Loverboy by Mariah Carey Featuring Cameo,2001,1,"mixed, majority men","['m', 'm', 'f']",3,1,at least 1 woman,1 or more women in credits,1 or more men,m;f
405380,1,I'm Real by Jennifer Lopez Featuring Ja Rule,2001,1,"mixed, majority men","['m', 'm', 'm', 'm', 'm', 'm', 'f']",7,1,at least 1 woman,1 or more women in credits,1 or more men,m;f
402410,1,Fallin' by Alicia Keys,2001,1,only women,['f'],1,1,only women,1 or more women in credits,only women,f
406521,5,Turn Off The Light by Nelly Furtado,2001,1,only women,['f'],1,1,only women,1 or more women in credits,only women,f
410696,4,Get The Party Started by P!nk,2001,1,only women,['f'],1,1,only women,1 or more women in credits,only women,f
403601,1,Bootylicious by Destiny's Child,2001,1,parity,"['f', 'f', 'm', 'm']",4,2,at least 1 woman,1 or more women in credits,1 or more men,f
397405,3,Love Don't Cost A Thing by Jennifer Lopez,2001,1,"mixed, majority men","['f', 'm', 'f', '?', 'm']",5,2,at least 1 woman,1 or more women in credits,1 or more men,f
406527,1,Family Affair by Mary J. Blige,2001,1,"mixed, majority men","['f', 'f', 'm', 'm', 'm', 'm', 'm', 'f']",8,3,at least 1 woman,1 or more women in credits,1 or more men,f
66547,1,Maria Maria by Santana Featuring The Product G&B,2000,0,only men,"['m', 'm', 'm', 'm', 'm', 'm', 'm']",7,0,no women,only men,1 or more men,m
66141,4,Get It On Tonite by Montell Jordan,2000,0,only men,"['m', 'm', 'm', 'm', 'm', 'm', 'm']",7,0,no women,only men,1 or more men,m
67776,3,Thong Song by Sisqo,2000,0,only men,"['m', 'm', 'm', 'm', 'm']",5,0,no women,only men,1 or more men,m
385894,2,He Wasn't Man Enough by Toni Braxton,2000,0,only men,"['m', 'm', 'm', 'm']",4,0,no women,only men,1 or more men,f
387618,5,No More by Ruff Endz,2000,0,only men,"['m', 'm', 'm', 'm']",4,0,no women,only men,1 or more men,m
388515,4,The Real Slim Shady by Eminem,2000,0,only men,"['m', 'm', 'm', 'm']",4,0,no women,only men,1 or more men,m
392609,1,"It Wasn't Me by Shaggy Featuring Ricardo \RikRok\"" Ducent""",2000,0,only men,"['m', 'm', 'm', 'm']",4,0,no women,only men,1 or more men,m
170464,3,Kryptonite by 3 Doors Down,2000,0,only men,"['m', 'm', 'm']",3,0,no women,only men,1 or more men,m
384453,4,Bye Bye Bye by N Sync,2000,0,only men,"['m', 'm', 'm']",3,0,no women,only men,1 or more men,m
385605,1,Be With You by Enrique Iglesias,2000,0,only men,"['m', 'm', 'm']",3,0,no women,only men,1 or more men,m
386963,1,It's Gonna Be Me by N Sync,2000,0,only men,"['m', 'm', 'm']",3,0,no women,only men,1 or more men,m
165807,1,With Arms Wide Open by Creed,2000,0,only men,"['m', 'm']",2,0,no women,only men,1 or more men,m
385807,1,Try Again by Aaliyah,2000,0,only men,"['m', 'm']",2,0,no women,only men,1 or more men,f
389375,4,Most Girls by P!nk,2000,0,only men,"['m', 'm']",2,0,no women,only men,1 or more men,f
66758,2,You Sang To Me by Marc Anthony,2000,0,only men,"['m', 'm']",2,0,no women,only men,1 or more men,m
386960,5,This I Promise You by N Sync,2000,0,only men,['m'],1,0,no women,only men,1 or more men,m
387867,1,Bent by matchbox twenty,2000,0,only men,['m'],1,0,no women,only men,1 or more men,m
67304,1,Everything You Want by Vertical Horizon,2000,0,only men,['m'],1,0,no women,only men,1 or more men,m
66794,5,I Try by Macy Gray,2000,0,"mixed, majority men","['f', 'm', 'm', 'm']",4,1,at least 1 woman,1 or more women in credits,1 or more men,f
389857,1,Doesn't Really Matter by Janet,2000,0,"mixed, majority men","['f', 'm', 'm']",3,1,at least 1 woman,1 or more women in credits,1 or more men,f
65654,4,I Wanna Know by Joe,2000,0,"mixed, majority men","['f', 'm', 'm']",3,1,at least 1 woman,1 or more women in credits,1 or more men,m
391889,1,Music by Madonna,2000,0,parity,"['f', 'm']",2,1,at least 1 woman,1 or more women in credits,1 or more men,f
64383,7,"Hot Boyz by Missy \Misdemeanor\"" Elliott Featuring NAS",2000,0,parity,"['f', 'm']",2,1,at least 1 woman,1 or more women in credits,1 or more men,m;f
67126,1,What A Girl Wants by Christina Aguilera,2000,0,parity,"['f', 'm']",2,1,at least 1 woman,1 or more women in credits,1 or more men,f
393482,2,He Loves U Not by Dream,2000,0,"mixed, majority men","['m', 'f', 'm']",3,1,at least 1 woman,1 or more women in credits,1 or more men,f
63031,1,Amazed by Lonestar,2000,0,"mixed, majority men","['m', 'f', 'm']",3,1,at least 1 woman,1 or more women in credits,1 or more men,m
393393,1,Independent Women Part I by Destiny's Child,2000,0,"mixed, majority men","['m', 'm', 'f', 'm']",4,1,at least 1 woman,1 or more women in credits,1 or more men,f
65947,3,"Jumpin', Jumpin' by Destiny's Child",2000,0,"mixed, majority men","['m', 'm', 'f', 'm']",4,1,at least 1 woman,1 or more women in credits,1 or more men,f
384031,1,Incomplete by Sisqo,2000,0,"mixed, majority men","['m', 'm', 'f']",3,1,at least 1 woman,1 or more women in credits,1 or more men,m
391549,2,Case Of The Ex (Whatcha Gonna Do) by Mya,2000,0,"mixed, majority men","['m', 'm', 'f']",3,1,at least 1 woman,1 or more women in credits,1 or more men,f
392367,4,Gotta Tell You by Samantha Mumba,2000,0,"mixed, majority men","['m', 'm', 'f']",3,1,at least 1 woman,1 or more women in credits,1 or more men,f
392577,2,Give Me Just One Night (Una Noche) by 98 Degrees,2000,0,"mixed, majority men","['m', 'm', 'f']",3,1,at least 1 woman,1 or more women in credits,1 or more men,m
67188,1,Thank God I Found You by Mariah Carey Featuring Joe & 98 Degrees,2000,0,"mixed, majority men","['m', 'm', 'f']",3,1,at least 1 woman,1 or more women in credits,1 or more men,m;f
386616,3,I Turn To You by Christina Aguilera,2000,0,only women,['f'],1,1,only women,1 or more women in credits,only women,f
66681,2,Breathe by Faith Hill,2000,0,only women,"['f', 'f']",2,2,only women,1 or more women in credits,only women,f
162099,1,Come On Over Baby (All I Want Is You) by Christina Aguilera,2000,0,"mixed, majority men","['m', 'm', 'f', 'm', 'm', 'm', 'f', 'm', 'm']",9,2,at least 1 woman,1 or more women in credits,1 or more men,f
67145,1,Say My Name by Destiny's Child,2000,0,"mixed, majority women","['m', 'm', 'm', 'f', 'f', 'f', 'f']",7,4,at least 1 woman,1 or more women in credits,1 or more men,f
64897,5,Bring It All To Me by Blaque,2000,0,"mixed, majority women","['m', 'm', 'f', 'm', 'f', 'f', 'f', 'f']",8,5,at least 1 woman,1 or more women in credits,1 or more men,f
59701,1,Believe by Cher,1999,0,only men,"['m', 'm', 'm', 'm']",4,0,no women,only men,1 or more men,f
63295,1,If You Had My Love by Jennifer Lopez,1999,0,only men,"['m', 'm', 'm', 'm']",4,0,no women,only men,1 or more men,f
63776,1,Wild Wild West by Will Smith Featuring Dru Hill & Kool Mo Dee,1999,0,only men,"['m', 'm', 'm', 'm']",4,0,no women,only men,1 or more men,m
63920,2,She's All I Ever Had by Ricky Martin,1999,0,only men,"['m', 'm', 'm', 'm']",4,0,no women,only men,1 or more men,m
64130,3,Summer Girls by LFO,1999,0,only men,"['m', 'm', 'm']",3,0,no women,only men,1 or more men,m
65530,5,Lost In You by Garth Brooks as Chris Gaines,1999,0,only men,"['m', 'm', 'm']",3,0,no women,only men,1 or more men,m
65788,3,Mambo No. 5 (A Little Bit Of...) by Lou Bega,1999,0,only men,"['m', 'm', 'm']",3,0,no women,only men,1 or more men,m
60250,3,Every Morning by Sugar Ray,1999,0,only men,"['m', 'm', 'm', 'm', 'm']",5,0,no women,only men,1 or more men,m
58392,1,Angel Of Mine by Monica,1999,0,only men,"['m', 'm']",2,0,no women,only men,1 or more men,f
60218,4,My Love Is Your Love by Whitney Houston,1999,0,only men,"['m', 'm']",2,0,no women,only men,1 or more men,f
62086,5,The Hardest Thing by 98 Degrees,1999,0,only men,"['m', 'm']",2,0,no women,only men,1 or more men,m
62884,1,Livin' La Vida Loca by Ricky Martin,1999,0,only men,"['m', 'm']",2,0,no women,only men,1 or more men,m
63777,2,Tell Me It's Real by K-Ci & JoJo,1999,0,only men,"['m', 'm']",2,0,no women,only men,1 or more men,m
64262,1,Bailamos by Enrique Iglesias,1999,0,only men,"['m', 'm']",2,0,no women,only men,1 or more men,m
64266,1,Smooth by Santana Featuring Rob Thomas,1999,0,only men,"['m', 'm']",2,0,no women,only men,1 or more men,m
65787,3,I Need To Know by Marc Anthony,1999,0,only men,"['m', 'm']",2,0,no women,only men,1 or more men,m
66256,3,I Wanna Love You Forever by Jessica Simpson,1999,0,only men,"['m', 'm']",2,0,no women,only men,1 or more men,f
66506,1,I Knew I Loved You by Savage Garden,1999,0,only men,"['m', 'm']",2,0,no women,only men,1 or more men,m
56459,5,Jumper by Third Eye Blind,1999,0,only men,['m'],1,0,no women,only men,1 or more men,m
57195,5,Save Tonight by Eagle-Eye Cherry,1999,0,only men,['m'],1,0,no women,only men,1 or more men,m
58054,2,Kiss Me by Sixpence None The Richer,1999,0,only men,['m'],1,0,no women,only men,1 or more men,m;f
60294,5,All I Have To Give by Backstreet Boys,1999,0,only men,['m'],1,0,no women,only men,1 or more men,m
60938,2,Last Kiss by Pearl Jam,1999,0,only men,['m'],1,0,no women,only men,1 or more men,m
62077,4,Fortunate by Maxwell,1999,0,only men,['m'],1,0,no women,only men,1 or more men,m
63202,4,All Star by Smash Mouth,1999,0,only men,['m'],1,0,no women,only men,1 or more men,m
65790,2,Back At One by Brian McKnight,1999,0,only men,['m'],1,0,no women,only men,1 or more men,m
62106,4,Where My Girls At? by 702,1999,0,"mixed, majority men","['f', 'm', 'm']",3,1,at least 1 woman,1 or more women in credits,1 or more men,f
59012,4,Angel by Sarah McLachlan,1999,0,parity,"['f', 'm']",2,1,at least 1 woman,1 or more women in credits,1 or more men,f
59822,4,It's Not Right But It's Okay by Whitney Houston,1999,0,"mixed, majority men","['m', 'f', 'm', 'm', 'm']",5,1,at least 1 woman,1 or more women in credits,1 or more men,f
63926,1,Genie In A Bottle by Christina Aguilera,1999,0,"mixed, majority men","['m', 'f', 'm']",3,1,at least 1 woman,1 or more women in credits,1 or more men,f
63026,1,Unpretty by TLC,1999,0,parity,"['m', 'f']",2,1,at least 1 woman,1 or more women in credits,1 or more men,f
348355,2,Heartbreak Hotel by Whitney Houston Feat. Faith Evans & Kelly Price,1999,0,"mixed, majority men","['m', 'm', 'f']",3,1,at least 1 woman,1 or more women in credits,1 or more men,f
60551,3,What's It Gonna Be?! by Busta Rhymes Featuring Janet,1999,0,"mixed, majority men","['m', 'm', 'f']",3,1,at least 1 woman,1 or more women in credits,1 or more men,m;f
61002,5,Who Dat by JT Money Featuring Sole,1999,0,"mixed, majority men","['m', 'm', 'm', 'f', 'm']",5,1,at least 1 woman,1 or more women in credits,1 or more men,m;f
60026,4,I Still Believe by Mariah Carey,1999,0,"mixed, majority men","['m', 'm', 'm', 'f']",4,1,at least 1 woman,1 or more women in credits,1 or more men,f
66026,2,Satisfy You by Puff Daddy Featuring R. Kelly,1999,0,"mixed, majority men","['m', 'm', 'm', 'm', 'm', 'f', 'm', 'm']",8,1,at least 1 woman,1 or more women in credits,1 or more men,m
57212,1,Have You Ever? by Brandy,1999,0,only women,['f'],1,1,only women,1 or more women in credits,only women,f
65607,2,Music Of My Heart by N Sync & Gloria Estefan,1999,0,only women,['f'],1,1,only women,1 or more women in credits,only women,m;f
61093,1,No Scrubs by TLC,1999,0,"mixed, majority women","['m', 'f', 'f']",3,2,at least 1 woman,1 or more women in credits,1 or more men,f
66020,1,Heartbreaker by Mariah Carey Featuring Jay-Z,1999,0,"mixed, majority men","['m', 'f', 'm', 'f', 'm', 'm']",6,2,at least 1 woman,1 or more women in credits,1 or more men,f
63311,1,"Bills, Bills, Bills by Destiny's Child",1999,0,"mixed, majority women","['f', 'm', 'f', 'f', 'f']",5,4,at least 1 woman,1 or more women in credits,1 or more men,f
54712,1,Too Close by Next,1998,0,only men,"['m', 'm', 'm', 'm', 'm', 'm', 'm', 'm']",8,0,no women,only men,1 or more men,m
53978,1,Gettin' Jiggy Wit It by Will Smith,1998,0,only men,"['m', 'm', 'm', 'm', 'm']",5,0,no women,only men,1 or more men,m
56777,4,Come With Me by Puff Daddy Featuring Jimmy Page,1998,0,only men,"['m', 'm', 'm', 'm', 'm']",5,0,no women,only men,1 or more men,m
53412,1,Nice & Slow by Usher,1998,0,only men,"['m', 'm', 'm', 'm']",4,0,no women,only men,1 or more men,m
58369,3,Because Of You by 98 Degrees,1998,0,only men,"['m', 'm', 'm', 'm']",4,0,no women,only men,1 or more men,m
54094,1,All My Life by K-Ci & JoJo,1998,0,only men,"['m', 'm', 'm']",3,0,no women,only men,1 or more men,m
54995,2,Let's Ride by Montell Jordan Feat. Master P & Silkk The Shocker,1998,0,only men,"['m', 'm', 'm']",3,0,no women,only men,1 or more men,m
55862,2,My Way by Usher,1998,0,only men,"['m', 'm', 'm']",3,0,no women,only men,1 or more men,m
52737,4,Everybody [Backstreet's Back] by Backstreet Boys,1998,0,only men,"['m', 'm']",2,0,no women,only men,1 or more men,m
53392,1,Truly Madly Deeply by Savage Garden,1998,0,only men,"['m', 'm']",2,0,no women,only men,1 or more men,m
54234,1,My Heart Will Go On by Celine Dion,1998,0,only men,"['m', 'm']",2,0,no women,only men,1 or more men,f
58176,1,Lately by Divine,1998,0,only men,"['m', 'm']",2,0,no women,only men,1 or more men,f
58469,2,Nobody's Supposed To Be Here by Deborah Cox,1998,0,only men,"['m', 'm']",2,0,no women,only men,1 or more men,f
53748,5,I'll Be by Edwin McCain,1998,0,only men,['m'],1,0,no women,only men,1 or more men,m
56960,1,One Week by Barenaked Ladies,1998,0,only men,['m'],1,0,no women,only men,1 or more men,m
58919,1,...Baby One More Time by Britney Spears,1998,0,only men,['m'],1,0,no women,only men,1 or more men,f
59202,1,I'm Your Angel by R. Kelly & Celine Dion,1998,0,only men,['m'],1,0,no women,only men,1 or more men,m;f
52509,5,Body Bumpin' Yippie-Yi-Yo by Public Announcement,1998,0,only men,"['m', 'm', '?']",3,0,no women,only men,1 or more men,m
58270,3,How Deep Is Your Love by Dru Hill Featuring Redman,1998,0,"mixed, majority men","['f', 'm', 'm', 'm', 'm']",5,1,at least 1 woman,1 or more women in credits,1 or more men,m
53413,3,I Get Lonely by Janet Featuring BLACKstreet,1998,0,"mixed, majority men","['f', 'm', 'm', 'm']",4,1,at least 1 woman,1 or more women in credits,1 or more men,m;f
55943,4,Never Ever by All Saints,1998,0,"mixed, majority men","['f', 'm', 'm']",3,1,at least 1 woman,1 or more women in credits,1 or more men,f
54875,2,You're Still The One by Shania Twain,1998,0,parity,"['f', 'm']",2,1,at least 1 woman,1 or more women in credits,1 or more men,f
55186,2,Frozen by Madonna,1998,0,parity,"['f', 'm']",2,1,at least 1 woman,1 or more women in credits,1 or more men,f
55488,3,Adia by Sarah McLachlan,1998,0,parity,"['f', 'm']",2,1,at least 1 woman,1 or more women in credits,1 or more men,f
58193,4,From This Moment On by Shania Twain,1998,0,parity,"['f', 'm']",2,1,at least 1 woman,1 or more women in credits,1 or more men,f
53190,1,My All by Mariah Carey,1998,0,"mixed, majority men","['m', 'm', 'f', 'm', 'x']",5,1,at least 1 woman,1 or more women in credits,1 or more men,f
53658,3,"No, No, No by Destiny's Child",1998,0,"mixed, majority men","['m', 'm', 'f', 'm']",4,1,at least 1 woman,1 or more women in credits,1 or more men,f
57441,3,Crush by Jennifer Paige,1998,0,"mixed, majority men","['m', 'm', 'f', 'm']",4,1,at least 1 woman,1 or more women in credits,1 or more men,f
56390,1,The Boy Is Mine by Brandy & Monica,1998,0,"mixed, majority men","['m', 'm', 'm', 'f', 'm']",5,1,at least 1 woman,1 or more women in credits,1 or more men,f
56278,5,"Make It Hot by Nicole Featuring Missy \Misdemeanor\"" Elliott & Mocha""",1998,0,only women,['f'],1,1,only women,1 or more women in credits,only women,f
56747,1,I Don't Want To Miss A Thing by Aerosmith,1998,0,only women,['f'],1,1,only women,1 or more women in credits,only women,m
58351,1,Doo Wop (That Thing) by Lauryn Hill,1998,0,only women,['f'],1,1,only women,1 or more women in credits,only women,f
55657,5,Ray Of Light by Madonna,1998,0,"mixed, majority men","['f', 'm', 'm', 'm', 'f']",5,2,at least 1 woman,1 or more women in credits,1 or more men,f
57707,1,The First Night by Monica,1998,0,"mixed, majority women","['f', 'f', 'm', 'f']",4,3,at least 1 woman,1 or more women in credits,1 or more men,f
47695,1,Can't Nobody Hold Me Down by Puff Daddy (Featuring Mase),1997,0,only men,"['m', 'm', 'm', 'm', 'm', 'm', 'm', 'm']",8,0,no women,only men,1 or more men,m
48758,1,Hypnotize by The Notorious B.I.G.,1997,0,only men,"['m', 'm', 'm', 'm', 'm', 'm', 'm', 'm']",8,0,no women,only men,1 or more men,m
52819,5,Feel So Good by Mase,1997,0,only men,"['m', 'm', 'm', 'm', 'm', 'm', 'm', 'm']",8,0,no women,only men,1 or more men,m
48123,4,"I Believe In You And Me (From \The Preacher's Wife\"")"" by Whitney Houston",1997,0,only men,"['m', 'm', 'm', 'm', 'm']",5,0,no women,only men,1 or more men,f
49872,1,Mo Money Mo Problems by The Notorious B.I.G. Featuring Puff Daddy & Mase,1997,0,only men,"['m', 'm', 'm', 'm', 'm']",5,0,no women,only men,1 or more men,m
48023,4,In My Bed by Dru Hill,1997,0,only men,"['m', 'm', 'm']",3,0,no women,only men,1 or more men,m
49472,1,MMMBop by Hanson,1997,0,only men,"['m', 'm', 'm']",3,0,no women,only men,1 or more men,m
51449,2,You Make Me Wanna... by Usher,1997,0,only men,"['m', 'm', 'm']",3,0,no women,only men,1 or more men,m
48644,4,I Want You by Savage Garden,1997,0,only men,"['m', 'm']",2,0,no women,only men,1 or more men,m
48728,4,All By Myself by Celine Dion,1997,0,only men,"['m', 'm']",2,0,no women,only men,1 or more men,f
50102,2,Quit Playing Games (With My Heart) by Backstreet Boys,1997,0,only men,"['m', 'm']",2,0,no women,only men,1 or more men,m
50723,4,"Look Into My Eyes (From \Batman & Robin\"")"" by Bone Thugs-N-Harmony",1997,0,only men,"['m', 'm']",2,0,no women,only men,1 or more men,m
52709,1,4 Seasons Of Loneliness by Boyz II Men,1997,0,only men,"['m', 'm']",2,0,no women,only men,1 or more men,m
53089,1,Candle In The Wind 1997/Something About The Way You Look Tonight by Elton John,1997,0,only men,"['m', 'm']",2,0,no women,only men,1 or more men,m
45684,2,Return Of The Mack by Mark Morrison,1997,0,only men,['m'],1,0,no women,only men,1 or more men,m
49033,5,The Freshmen by The Verve Pipe,1997,0,only men,['m'],1,0,no women,only men,1 or more men,m
49383,4,Semi-Charmed Life by Third Eye Blind,1997,0,only men,['m'],1,0,no women,only men,1 or more men,m
50692,4,All Cried Out by Allure Featuring 112,1997,0,only men,['m'],1,0,no women,only men,1 or more men,m;f
53365,1,Together Again by Janet,1997,0,"mixed, majority men","['f', 'm', 'm', 'm']",4,1,at least 1 woman,1 or more women in credits,1 or more men,f
49848,4,2 Become 1 by Spice Girls,1997,0,"mixed, majority men","['f', 'm', 'm']",3,1,at least 1 woman,1 or more women in credits,1 or more men,f
50724,1,I'll Be Missing You by Puff Daddy & Faith Evans Featuring 112,1997,0,"mixed, majority men","['m', 'f', 'm']",3,1,at least 1 woman,1 or more women in credits,1 or more men,m;f
46811,2,Foolish Games/You Were Meant For Me by Jewel,1997,0,parity,"['m', 'f']",2,1,at least 1 woman,1 or more women in credits,1 or more men,f
49164,3,Say You'll Be There by Spice Girls,1997,0,parity,"['m', 'f']",2,1,at least 1 woman,1 or more women in credits,1 or more men,f
50301,2,Been Around The World by Puff Daddy & The Family (Feat. The Notorious B.I.G. & Mase),1997,0,"mixed, majority men","['m', 'm', 'f', 'm', 'm', 'm', 'm', 'm']",8,1,at least 1 woman,1 or more women in credits,1 or more men,m
48330,1,Wannabe by Spice Girls,1997,0,"mixed, majority men","['m', 'm', 'f']",3,1,at least 1 woman,1 or more women in credits,1 or more men,f
53192,4,My Body by LSG,1997,0,"mixed, majority men","['m', 'm', 'f']",3,1,at least 1 woman,1 or more women in credits,1 or more men,m
51968,1,Honey by Mariah Carey,1997,0,"mixed, majority men","['m', 'm', 'm', 'f', 'm', 'm', 'm', 'm']",8,1,at least 1 woman,1 or more women in credits,1 or more men,f
51559,4,My Love Is The Shhh! by Somethin' For The People Featuring Trina & Tamara,1997,0,"mixed, majority men","['m', 'm', 'm', 'm', 'f', 'm']",6,1,at least 1 woman,1 or more women in credits,1 or more men,m;f
48125,4,"For You I Will (From \Space Jam\"")"" by Monica",1997,0,only women,['f'],1,1,only women,1 or more women in credits,only women,f
50892,2,How Do I Live by LeAnn Rimes,1997,0,only women,['f'],1,1,only women,1 or more women in credits,only women,f
49817,2,Bitch by Meredith Brooks,1997,0,only women,"['f', 'f']",2,2,only women,1 or more women in credits,only women,f
43014,1,How Do U Want It/California Love by 2Pac Featuring K-Ci And JoJo,1996,0,only men,"['m', 'm', 'm', 'm', 'm', 'm', 'm', 'm']",8,0,no women,only men,1 or more men,m
45287,3,Hit Me Off by New Edition,1996,0,only men,"['m', 'm', 'm', 'm', 'm']",5,0,no women,only men,1 or more men,m
42917,1,Tha Crossroads by Bone Thugs-N-Harmony,1996,0,only men,"['m', 'm', 'm', 'm']",4,0,no women,only men,1 or more men,m
40471,3,Loungin by LL Cool J,1996,0,only men,"['m', 'm', 'm']",3,0,no women,only men,1 or more men,m
42113,3,C'mon N' Ride It (The Train) by Quad City DJ's,1996,0,only men,"['m', 'm', 'm']",3,0,no women,only men,1 or more men,m;f
44455,2,Twisted by Keith Sweat,1996,0,only men,"['m', 'm', 'm']",3,0,no women,only men,1 or more men,m
44872,5,Change The World by Eric Clapton,1996,0,only men,"['m', 'm', 'm']",3,0,no women,only men,1 or more men,m
36035,1,Macarena (Bayside Boys Mix) by Los Del Rio,1996,0,only men,"['m', 'm']",2,0,no women,only men,1 or more men,m
38989,2,Nobody Knows by The Tony Rich Project,1996,0,only men,"['m', 'm']",2,0,no women,only men,1 or more men,m
39827,5,I Can't Sleep Baby (If I) by R. Kelly,1996,0,only men,"['m', 'm']",2,0,no women,only men,1 or more men,m
42118,5,"1, 2, 3, 4 (Sumpin' New) by Coolio",1996,0,only men,"['m', 'm']",2,0,no women,only men,1 or more men,m
44304,1,You're Makin' Me High/Let It Flow by Toni Braxton,1996,0,only men,"['m', 'm']",2,0,no women,only men,1 or more men,f
44743,5,Where Do You Go by No Mercy,1996,0,only men,"['m', 'm']",2,0,no women,only men,1 or more men,m
45184,3,Nobody by Keith Sweat Featuring Athena Cage,1996,0,only men,"['m', 'm']",2,0,no women,only men,1 or more men,m;f
34599,5,Breakfast At Tiffany's by Deep Blue Something,1996,0,only men,['m'],1,0,no women,only men,1 or more men,m
35621,5,Name by Goo Goo Dolls,1996,0,only men,['m'],1,0,no women,only men,1 or more men,m
35838,4,One Of Us by Joan Osborne,1996,0,only men,['m'],1,0,no women,only men,1 or more men,f
39795,2,"Not Gon' Cry (From \Waiting To Exhale\"")"" by Mary J. Blige",1996,0,only men,['m'],1,0,no women,only men,1 or more men,f
39811,4,Down Low (Nobody Has To Know) by R. Kelly Featuring Ronald Isley,1996,0,only men,['m'],1,0,no women,only men,1 or more men,m
39939,2,"Sittin' Up In My Room (From \Waiting To Exhale\"")"" by Brandy",1996,0,only men,['m'],1,0,no women,only men,1 or more men,f
45830,2,It's All Coming Back To Me Now by Celine Dion,1996,0,only men,['m'],1,0,no women,only men,1 or more men,f
47344,2,"I Believe I Can Fly (From \Space Jam\"")"" by R. Kelly",1996,0,only men,['m'],1,0,no women,only men,1 or more men,m
45945,1,No Diggity by BLACKstreet (Featuring Dr. Dre),1996,0,"mixed, majority men","['f', 'm', 'm', 'x', 'm', 'm', 'm', 'm']",8,1,at least 1 woman,1 or more women in credits,1 or more men,m;f
31679,2,Missing by Everything But The Girl,1996,0,parity,"['m', 'f']",2,1,at least 1 woman,1 or more women in credits,1 or more men,m;f
39797,4,Ironic by Alanis Morissette,1996,0,parity,"['m', 'f']",2,1,at least 1 woman,1 or more women in credits,1 or more men,f
38576,1,Always Be My Baby by Mariah Carey,1996,0,"mixed, majority men","['m', 'm', 'f', 'm', 'm']",5,1,at least 1 woman,1 or more women in credits,1 or more men,f
