title_id,peak_position,song_key,year,since 2000,cut_two,songwriter_gender,song writer count,count of women,cut,has no women,has no men,artist_gender
new_181,5,staying alive by dj khaled featuring drake & lil baby,2022,1,only men,"['m', 'm', 'm', 'm', 'm', 'm', 'm', 'm']",8,0,no women,only men,1 or more men,m
new_172,3,n95 by kendrick lamar,2022,1,only men,"['m', 'm', 'm', 'm', 'm', 'm']",6,0,no women,only men,1 or more men,m
new_159,5,enemy by imagine dragons x jid,2022,1,only men,"['m', 'm', 'm', 'm', 'm', 'nb', 'm', 'm']",8,0,no women,only men,1 or more men,m
new_178,1,jimmy cooks by drake featuring 21 savage,2022,1,only men,"['m', 'm', 'm', 'm', 'm', 'm', 'm', 'm', 'm', 'm']",10,0,no women,only men,1 or more men,m
new_131,5,ghost by justin bieber,2022,1,only men,"['m', 'm', 'm', 'm', 'm']",5,0,no women,only men,1 or more men,m
new_192,3,major distribution by drake & 21 savage,2022,1,only men,"['m', 'm', 'm', 'm', 'm']",5,0,no women,only men,1 or more men,m
new_171,5,you proof by morgan wallen,2022,1,only men,"['m', 'm', 'm', 'm']",4,0,no women,only men,1 or more men,m
new_169,4,moscow mule by bad bunny,2022,1,only men,"['m', 'm', 'm', 'm', 'm', 'm']",6,0,no women,only men,1 or more men,m
new_156,3,super gremlin by kodak black,2022,1,only men,"['m', 'm', 'm']",3,0,no women,only men,1 or more men,m
new_164,1,as it was by harry styles,2022,1,only men,"['m', 'm', 'm']",3,0,no women,only men,1 or more men,m
new_175,4,sunroof by nicky youre & dazy,2022,1,only men,"['m', 'm', 'm']",3,0,no women,only men,1 or more men,m 
new_191,4,on bs by drake & 21 savage,2022,1,only men,"['m', 'm', 'm', 'm', 'm']",5,0,no women,only men,1 or more men,m
new_170,5,titi me pregunto by bad bunny,2022,1,only men,"['m', 'm', 'm', 'm']",4,0,no women,only men,1 or more men,m
new_174,3,late night talking by harry styles,2022,1,only men,"['m', 'm']",2,0,no women,only men,1 or more men,m
new_167,4,puffin on zootiez by future,2022,1,only men,"['m', 'm', 'm', 'm']",4,0,no women,only men,1 or more men,m
new_184,4,california breeze by lil baby,2022,1,only men,"['m', 'm', 'm']",3,0,no women,only men,1 or more men,m
new_004,4,last christmas by wham!,2022,1,only men,['m'],1,0,no women,only men,1 or more men,m
new_122,1,heat waves by glass animals,2022,1,only men,['m'],1,0,no women,only men,1 or more men,m
new_162,1,"we don't talk about bruno by carolina gaitan, mauro castillo, adassa, rhenzy feliz, diane guerrero, stephanie beatriz & encanto cast",2022,1,only men,['m'],1,0,no women,only men,1 or more men,m;f
new_183,1,unholy by sam smith & kim petras,2022,1,only men,['m'],1,0,no women,only men,1 or more men,f;nb
new_176,3,running up that hill (a deal with god) by kate bush,2022,1,only women,['f'],1,1,only women,1 or more women in credits,only women,f
new_177,3,i like you (a happier song) by post malone featuring doja cat,2022,1,"mixed, majority men","['f', 'm', 'm', 'm', 'm']",5,1,at least 1 woman,1 or more women in credits,1 or more men,m;f
new_185,5,midnight rain by taylor swift,2022,1,parity,"['m', 'f']",2,1,at least 1 woman,1 or more women in credits,1 or more men,f
new_187,3,maroon by taylor swift,2022,1,parity,"['m', 'f']",2,1,at least 1 woman,1 or more women in credits,1 or more men,f
new_188,1,anti-hero by taylor swift,2022,1,parity,"['m', 'f']",2,1,at least 1 woman,1 or more women in credits,1 or more men,f
new_179,1,break my soul by beyonce,2022,1,"mixed, majority men","['m', 'm', 'f', 'm', 'm', 'nb', 'm', 'm']",8,1,at least 1 woman,1 or more women in credits,1 or more men,f
new_163,2,do we have a problem? by nicki minaj x lil baby,2022,1,"mixed, majority men","['m', 'm', 'f', 'm']",4,1,at least 1 woman,1 or more women in credits,1 or more men,m;f
new_196,3,kill bill by sza,2022,1,"mixed, majority men","['m', 'm', 'f']",3,1,at least 1 woman,1 or more women in credits,1 or more men,f
new_166,1,about damn time by lizzo,2022,1,"mixed, majority men","['m', 'm', 'm', 'f', 'm', 'm', 'm']",7,1,at least 1 woman,1 or more women in credits,1 or more men,f
new_173,5,"die hard by kendrick lamar, blxst & amanda reifer",2022,1,"mixed, majority men","['m', 'm', 'm', 'm', 'f', 'm', 'm', 'm', 'm', 'm', 'm', 'm', 'm', 'm']",14,1,at least 1 woman,1 or more women in credits,1 or more men,m;f
new_168,1,wait for u by future featuring drake & tems,2022,1,"mixed, majority men","['m', 'm', 'm', 'm', 'm', 'm', 'm', 'm', 'm', 'm', 'f']",11,1,at least 1 woman,1 or more women in credits,1 or more men,m;f
new_165,1,first class by jack harlow,2022,1,"mixed, majority men","['m', 'm', 'm', 'm', 'm', 'm', 'm', 'm', 'm', 'm', 'm', 'f', 'm']",13,1,at least 1 woman,1 or more women in credits,1 or more men,m
new_194,5,spin bout u by drake & 21 savage,2022,1,"mixed, majority men","['m', 'm', 'm', 'm', 'm', 'f']",6,1,at least 1 woman,1 or more women in credits,1 or more men,m
new_180,1,bad habit by steve lacy,2022,1,"mixed, majority men","['f', 'f', 'm', 'm', 'm']",5,2,at least 1 woman,1 or more women in credits,1 or more men,m
new_189,4,snow on the beach by taylor swift featuring lana del rey,2022,1,"mixed, majority women","['f', 'm', 'f']",3,2,at least 1 woman,1 or more women in credits,1 or more men,f
new_161,3,abcdefu by gayle,2022,1,"mixed, majority women","['m', 'f', 'f']",3,2,at least 1 woman,1 or more women in credits,1 or more men,f
new_190,2,lift me up by rihanna,2022,1,parity,"['m', 'f', 'm', 'f']",4,2,at least 1 woman,1 or more women in credits,1 or more men,f
new_195,5,"creepin' by metro boomin, the weeknd & 21 savage",2022,1,"mixed, majority men","['m', 'f', 'm', 'm', 'm', 'm', 'm', 'f']",8,2,at least 1 woman,1 or more women in credits,1 or more men,m
new_182,1,super freaky girl by nicki minaj,2022,1,"mixed, majority men","['m', 'm', 'f', 'm', 'm', 'f', 'm', 'm']",8,2,at least 1 woman,1 or more women in credits,1 or more men,f
new_186,2,lavender haze by taylor swift,2022,1,"mixed, majority men","['m', 'm', 'm', 'm', 'f', 'f']",6,2,at least 1 woman,1 or more women in credits,1 or more men,f
new_193,2,rich flex by drake & 21 savage,2022,1,"mixed, majority men","['m', 'm', 'm', 'm', 'm', 'm', 'm', 'f', 'm', 'm', 'm', 'f', 'm', 'm']",14,2,at least 1 woman,1 or more women in credits,1 or more men,m
new_155,3,big energy by latto,2022,1,"mixed, majority men","['m', 'f', 'f', 'm', 'm', 'm', 'm', 'm', 'm', 'f', 'm']",11,3,at least 1 woman,1 or more women in credits,1 or more men,f
new_137,5,amari by j. cole,2021,1,only men,"['m', '?', 'm', 'm']",4,0,no women,only men,1 or more men,m
new_153,1,my universe by coldplay x bts,2021,1,only men,"['m', 'm', 'm', 'm', 'm', 'm', 'm', 'm', 'm', 'm']",10,0,no women,only men,1 or more men,m
new_144,1,stay by the kid laroi & justin bieber,2021,1,only men,"['m', 'm', 'm', 'm', 'm', 'm', 'm', 'm', 'm']",9,0,no women,only men,1 or more men,m
new_145,1,industry baby by lil nas x & jack harlow,2021,1,only men,"['m', 'm', 'm', 'm', 'm', 'm', 'm', 'm', 'm']",9,0,no women,only men,1 or more men,m
new_147,4,champagne poetry by drake,2021,1,only men,"['m', 'm', 'm', 'm', 'm', 'm', 'm', 'm', 'm']",9,0,no women,only men,1 or more men,m
new_149,4,knife talk by drake featuring 21 savage & project pat,2021,1,only men,"['m', 'm', 'm', 'm', 'm', 'm', 'm', 'm', 'm']",9,0,no women,only men,1 or more men,m
new_121,1,save your tears by the weeknd & ariana grande,2021,1,only men,"['m', 'm', 'm', 'm', 'm', 'm']",6,0,no women,only men,1 or more men,m;f
new_127,2,wants and needs by drake featuring lil baby,2021,1,only men,"['m', 'm', 'm', 'm', 'm', 'm']",6,0,no women,only men,1 or more men,m
new_136,2,"my.life by j. cole, 21 savage & morray",2021,1,only men,"['m', 'm', 'm', 'm', 'm', 'm', 'm', 'm']",8,0,no women,only men,1 or more men,m
new_128,1,leave the door open by silk sonic (bruno mars & anderson .paak),2021,1,only men,"['m', 'm', 'm', 'm', 'm']",5,0,no women,only men,1 or more men,m
new_132,1,montero (call me by your name) by lil nas x,2021,1,only men,"['m', 'm', 'm', 'm', 'm']",5,0,no women,only men,1 or more men,m
new_134,1,rapstar by polo g,2021,1,only men,"['m', 'm', 'm', 'm', 'm']",5,0,no women,only men,1 or more men,m
new_148,1,way 2 sexy by drake featuring future & young thug,2021,1,only men,"['m', 'm', 'm', 'm', 'm', 'm', 'm', 'm']",8,0,no women,only men,1 or more men,m
new_141,3,fancy like by walker hayes,2021,1,only men,"['m', 'm', 'm', 'm']",4,0,no women,only men,1 or more men,m
new_151,2,girls want girls by drake featuring lil baby,2021,1,only men,"['m', 'm', 'm', 'm']",4,0,no women,only men,1 or more men,m
new_126,1,what's next by drake,2021,1,only men,"['m', 'm', 'm']",3,0,no women,only men,1 or more men,m
new_142,2,bad habits by ed sheeran,2021,1,only men,"['m', 'm', 'm']",3,0,no women,only men,1 or more men,m
new_157,5,smokin out the window by silk sonic (bruno mars & anderson .paak),2021,1,only men,"['m', 'm', 'm']",3,0,no women,only men,1 or more men,m
new_005,5,it's the most wonderful time of the year by andy williams,2021,1,only men,"['m', 'm']",2,0,no women,only men,1 or more men,m
new_125,3,calling my phone by lil tjay featuring 6lack,2021,1,only men,"['m', 'm', '?', 'm', 'm', 'm']",6,0,no women,only men,1 or more men,m
new_095,3,go crazy by chris brown & young thug,2021,1,only men,"['m', 'm', 'm', 'm', 'm', 'm', 'm', '?', 'm', 'm']",10,0,no women,only men,1 or more men,m
new_158,1,all too well (taylor's version) by taylor swift,2021,1,only women,"['f', 'f']",2,2,only women,1 or more women in credits,only women,f
new_124,1,up by cardi b,2021,1,"mixed, majority men","['f', 'm', 'm', 'm', 'm', 'm']",6,1,at least 1 woman,1 or more women in credits,1 or more men,f
new_154,1,easy on me by adele,2021,1,parity,"['f', 'm']",2,1,at least 1 woman,1 or more women in credits,1 or more men,f
new_160,5,oh my god by adele,2021,1,parity,"['f', 'm']",2,1,at least 1 woman,1 or more women in credits,1 or more men,f
new_140,1,butter by bts,2021,1,"mixed, majority men","['m ', 'f', 'm', 'm', 'm', 'm', 'm']",7,1,at least 1 woman,1 or more women in credits,1 or more men,m
new_143,1,permission to dance by bts,2021,1,"mixed, majority men","['m', 'f', 'm', 'm']",4,1,at least 1 woman,1 or more women in credits,1 or more men,m
new_123,1,drivers license by olivia rodrigo,2021,1,parity,"['m', 'f']",2,1,at least 1 woman,1 or more women in credits,1 or more men,f
new_152,4,shivers by ed sheeran,2021,1,"mixed, majority men","['m', 'm', 'f', 'm']",4,1,at least 1 woman,1 or more women in credits,1 or more men,m
new_130,1,peaches by justin bieber featuring daniel caesar & giveon,2021,1,"mixed, majority men","['m', 'm', 'm', 'f', 'm', 'm', 'm', 'm', 'm', 'm']",10,1,at least 1 woman,1 or more women in credits,1 or more men,m
new_129,3,lemon pepper freestyle by drake featuring rick ross,2021,1,"mixed, majority men","['m', 'm', 'm', 'f', 'm', 'm', 'm', 'm', 'm', 'm']",10,1,at least 1 woman,1 or more women in credits,1 or more men,m
new_146,4,rumors by lizzo featuring cardi b,2021,1,"mixed, majority men","['f', 'm', 'f', 'm', 'm', 'm']",6,2,at least 1 woman,1 or more women in credits,1 or more men,f
new_135,3,kiss me more by doja cat featuring sza,2021,1,"mixed, majority men","['f', 'm', 'm', 'm', 'm', 'm', 'f', 'm', 'm']",9,2,at least 1 woman,1 or more women in credits,1 or more men,f
new_139,3,levitating by dua lipa,2021,1,parity,"['m', 'f', 'f', 'm']",4,2,at least 1 woman,1 or more women in credits,1 or more men,f
new_113,2,levitating by dua lipa featuring dababy,2021,1,"mixed, majority men","['m', 'f', 'm', 'f', 'm']",5,2,at least 1 woman,1 or more women in credits,1 or more men,m;f
new_138,1,good 4 u by olivia rodrigo,2021,1,parity,"['m', 'f', 'm', 'f']",4,2,at least 1 woman,1 or more women in credits,1 or more men,f
new_133,3,deja vu by olivia rodrigo,2021,1,"mixed, majority men","['nb', 'm', 'm', 'f', 'f']",5,2,at least 1 woman,1 or more women in credits,1 or more men,f
new_150,3,fair trade by drake featuring travis scott,2021,1,"mixed, majority men","['m', 'm', 'f', 'm', 'f', 'm', 'm', 'f', 'm', 'm', 'm', 'm', 'm', 'm']",14,3,at least 1 woman,1 or more women in credits,1 or more men,m
new_120,2,34+35 by ariana grande feat. doja cat & megan thee stallion,2021,1,"mixed, majority men","['m', 'f', 'f', 'm', 'f', 'm', 'm', 'm', 'f', 'm', 'f']",11,5,at least 1 woman,1 or more women in credits,1 or more men,f
new_086,2,"whats poppin by jack harlow featuring dababy, tory lanez & lil wayne",2020,1,only men,"['m', 'm', 'm', 'm', 'm', 'm', 'm', 'm', 'm']",9,0,no women,only men,1 or more men,m
new_093,1,rockstar by dababy featuring roddy ricch,2020,1,only men,"['m', 'm', 'm', 'm', 'm', 'm', 'm', 'm', 'm']",9,0,no women,only men,1 or more men,m
new_111,3,holy by justin bieber featuring chance the rapper,2020,1,only men,"['m', 'm', 'm', 'm', 'm', 'm', 'm', 'm']",8,0,no women,only men,1 or more men,m
new_094,1,"the scotts by the scotts, travis scott & kid cudi",2020,1,only men,"['m', 'm', 'm', 'm', 'm', 'm', 'm']",7,0,no women,only men,1 or more men,m
new_079,1,the box by roddy ricch,2020,1,only men,"['m', 'm', 'm', 'm', 'm', 'm']",6,0,no women,only men,1 or more men,m
new_109,2,laugh now cry later by drake featuring lil durk,2020,1,only men,"['m', 'm', 'm', 'm', 'm', 'm']",6,0,no women,only men,1 or more men,m
new_078,1,blinding lights by the weeknd,2020,1,only men,"['m', 'm', 'm', 'm', 'm']",5,0,no women,only men,1 or more men,m
new_084,2,life is good by future featuring drake,2020,1,only men,"['m', 'm', 'm', 'm', 'm']",5,0,no women,only men,1 or more men,m
new_085,3,godzilla by eminem featuring juice wrld,2020,1,only men,"['m', 'm', 'm', 'm', 'm']",5,0,no women,only men,1 or more men,m
new_091,4,roses by saint jhn,2020,1,only men,"['m', 'm', 'm', 'm', 'm']",5,0,no women,only men,1 or more men,m
new_104,3,popstar by dj khaled featuring drake,2020,1,only men,"['m', 'm', 'm', 'm', 'm']",5,0,no women,only men,1 or more men,m
new_108,1,mood by 24kgoldn featuring iann dior,2020,1,only men,"['m', 'm', 'm', 'm', 'm']",5,0,no women,only men,1 or more men,m
new_076,1,watermelon sugar by harry styles,2020,1,only men,"['m', 'm', 'm', 'm']",4,0,no women,only men,1 or more men,m
new_097,3,gooba by 6ix9ine,2020,1,only men,"['m', 'm', 'm', 'm']",4,0,no women,only men,1 or more men,m
new_099,1,savage love (laxed - siren beat) by jawsh 685 x jason derulo,2020,1,only men,"['m', 'm', 'm', 'm']",4,0,no women,only men,1 or more men,m
new_101,3,the bigger picture by lil baby,2020,1,only men,"['m', 'm', 'm']",3,0,no women,only men,1 or more men,m
new_103,5,wishing well by juice wrld,2020,1,only men,"['m', 'm', 'm']",3,0,no women,only men,1 or more men,m
new_114,2,forever after all by luke combs,2020,1,only men,"['m', 'm', 'm']",3,0,no women,only men,1 or more men,m
new_001,3,jingle bell rock by bobby helms,2020,1,only men,"['m', 'm']",2,0,no women,only men,1 or more men,m
new_092,1,toosie slide by drake,2020,1,only men,"['m', 'm']",2,0,no women,only men,1 or more men,m
new_102,2,come & go by juice wrld x marshmello,2020,1,only men,"['m', 'm']",2,0,no women,only men,1 or more men,m
new_087,5,intentions by justin bieber featuring quavo,2020,1,only men,"['m', 'm', 'm', 'm', 'm']",5,0,no women,only men,1 or more men,m
new_006,4,a holly jolly christmas by burl ives,2020,1,only men,['m'],1,0,no women,only men,1 or more men,m
new_116,5,dakiti by bad bunny & jhay cortez,2020,1,only men,"['m', 'm', 'm', 'm', 'm', 'm', 'm', 'm']",8,0,no women,only men,1 or more men,m
new_072,4,dance monkey by tones and i,2020,1,only women,['f'],1,1,only women,1 or more women in credits,only women,f
new_083,2,yummy by justin bieber,2020,1,"mixed, majority men","['f', 'm', 'm', 'm', 'm']",5,1,at least 1 woman,1 or more women in credits,1 or more men,m
new_081,3,i hope by gabby barrett featuring charlie puth,2020,1,"mixed, majority men","['f', 'm', 'm', 'm']",4,1,at least 1 woman,1 or more women in credits,1 or more men,m;f
new_117,2,therefore i am by billie eilish,2020,1,parity,"['f', 'm']",2,1,at least 1 woman,1 or more women in credits,1 or more men,f
new_105,4,the 1 by taylor swift,2020,1,parity,"['m', 'f']",2,1,at least 1 woman,1 or more women in credits,1 or more men,f
new_106,1,cardigan by taylor swift,2020,1,parity,"['m', 'f']",2,1,at least 1 woman,1 or more women in credits,1 or more men,f
new_110,1,dynamite by bts,2020,1,parity,"['m', 'f']",2,1,at least 1 woman,1 or more women in credits,1 or more men,m
new_119,1,willow by taylor swift,2020,1,parity,"['m', 'f']",2,1,at least 1 woman,1 or more women in credits,1 or more men,f
new_112,1,franchise by travis scott featuring young thug & m.i.a.,2020,1,"mixed, majority men","['m', 'm', 'm', 'm', 'f', 'm', 'm', 'm', 'm']",9,1,at least 1 woman,1 or more women in credits,1 or more men,m;f
new_089,5,stupid love by lady gaga,2020,1,"mixed, majority men","['m', 'm', 'm', 'm', 'f']",5,1,at least 1 woman,1 or more women in credits,1 or more men,f
new_100,1,trollz by 6ix9ine & nicki minaj,2020,1,"mixed, majority men","['m', 'm', 'm', 'm', 'f', 'm']",6,1,at least 1 woman,1 or more women in credits,1 or more men,m;f
new_118,1,life goes on by bts,2020,1,"mixed, majority men","['f', 'm', 'm', 'm', 'm', 'f', 'm']",7,2,at least 1 woman,1 or more women in credits,1 or more men,m
new_107,1,wap by cardi b featuring megan thee stallion,2020,1,"mixed, majority men","['m', 'f', 'm', 'm', 'f', 'm']",6,2,at least 1 woman,1 or more women in credits,1 or more men,f
new_074,2,don't start now by dua lipa,2020,1,"mixed, majority women","['f', 'f', 'f', 'm']",4,3,at least 1 woman,1 or more women in credits,1 or more men,f
new_115,1,positions by ariana grande,2020,1,"mixed, majority men","['f', 'f', 'm', 'm', 'm', 'f', 'm']",7,3,at least 1 woman,1 or more women in credits,1 or more men,f
new_096,1,stuck with u by ariana grande & justin bieber,2020,1,"mixed, majority men","['f', 'm', 'm', 'm', 'm', 'f', 'f']",7,3,at least 1 woman,1 or more women in credits,1 or more men,m;f
new_090,1,savage by megan thee stallion,2020,1,"mixed, majority men","['f', 'm', 'm', 'm', 'm', 'm', 'f', 'f', 'm']",9,3,at least 1 woman,1 or more women in credits,1 or more men,f
new_082,1,say so by doja cat featuring nicki minaj,2020,1,"mixed, majority women","['m', 'f', 'm', 'f', 'f']",5,3,at least 1 woman,1 or more women in credits,1 or more men,f
new_088,4,on by bts,2020,1,"mixed, majority men","['f', 'm', 'm', 'f', 'f', 'f', 'm', 'm', 'm', 'm']",10,4,at least 1 woman,1 or more women in credits,1 or more men,m
new_098,1,rain on me by lady gaga & ariana grande,2020,1,"mixed, majority men","['f', 'f', 'm', 'm', 'm', 'f', 'm', 'f', 'm', 'm', 'f']",11,5,at least 1 woman,1 or more women in credits,1 or more men,f
new_056,5,homicide by logic featuring eminem,2019,1,only men,"['?', 'm', '?', 'm', 'm', 'm', '?']",7,0,no women,only men,1 or more men,m
new_080,5,futsal shuffle 2020 by lil uzi vert,2019,1,only men,"['m', 'm', 'm', '?', 'nb']",5,0,no women,only men,1 or more men,nb
new_052,1,sucker by jonas brothers,2019,1,only men,"['m', 'm', 'm', 'm', 'm', 'm', 'm', 'm', 'm']",9,0,no women,only men,1 or more men,m
new_069,2,memories by maroon 5,2019,1,only men,"['m', 'm', 'm', 'm', 'm', 'm', 'm']",7,0,no women,only men,1 or more men,m
new_046,2,wow. by post malone,2019,1,only men,"['m', 'm', 'm', 'm', 'm', 'm']",6,0,no women,only men,1 or more men,m
new_053,1,old town road by lil nas x featuring billy ray cyrus,2019,1,only men,"['m', 'm', 'm', 'm', 'm', 'm']",6,0,no women,only men,1 or more men,m
new_060,2,i don't care by ed sheeran & justin bieber,2019,1,only men,"['m', 'm', 'm', 'm', 'm', 'm']",6,0,no women,only men,1 or more men,m
new_059,1,someone you loved by lewis capaldi,2019,1,only men,"['m', 'm', 'm', 'm', 'm']",5,0,no women,only men,1 or more men,m
new_065,5,panini by lil nas x,2019,1,only men,"['m', 'm', 'm', 'm', 'm']",5,0,no women,only men,1 or more men,m
new_068,1,circles by post malone,2019,1,only men,"['m', 'm', 'm', 'm', 'm']",5,0,no women,only men,1 or more men,m
new_048,4,middle child by j. cole,2019,1,only men,"['m', 'm', 'm', 'm']",4,0,no women,only men,1 or more men,m
new_071,1,highest in the room by travis scott,2019,1,only men,"['m', 'm', 'm', 'm']",4,0,no women,only men,1 or more men,m
new_077,1,heartless by the weeknd,2019,1,only men,"['m', 'm', 'm', 'm']",4,0,no women,only men,1 or more men,m
new_057,2,if i can't have you by shawn mendes,2019,1,only men,"['m', 'm', 'm', 'nb']",4,0,no women,only men,1 or more men,m
new_050,3,talk by khalid,2019,1,only men,"['m', 'm', 'm']",3,0,no women,only men,1 or more men,m
new_061,4,ran$om by lil tecca,2019,1,only men,"['m', 'm', 'm']",3,0,no women,only men,1 or more men,m
new_002,2,rockin' around the christmas tree by brenda lee,2019,1,only men,['m'],1,0,no women,only men,1 or more men,f
new_051,3,please me by cardi b & bruno mars,2019,1,"mixed, majority men","['f', 'm', 'm', 'm', 'm', 'm', 'm']",7,1,at least 1 woman,1 or more women in credits,1 or more men,m;f
new_003,1,all i want for christmas is you by mariah carey,2019,1,parity,"['f', 'm']",2,1,at least 1 woman,1 or more women in credits,1 or more men,f
new_054,1,bad guy by billie eilish,2019,1,parity,"['f', 'm']",2,1,at least 1 woman,1 or more women in credits,1 or more men,f
new_063,2,you need to calm down by taylor swift,2019,1,parity,"['m', 'f']",2,1,at least 1 woman,1 or more women in credits,1 or more men,f
new_067,3,good as hell by lizzo,2019,1,parity,"['m', 'f']",2,1,at least 1 woman,1 or more women in credits,1 or more men,f
new_070,4,"10,000 hours by dan + shay & justin bieber",2019,1,"mixed, majority men","['m', 'm', 'f', 'm', 'm', 'm']",6,1,at least 1 woman,1 or more women in credits,1 or more men,m
new_055,2,me! by taylor swift featuring brendon urie,2019,1,"mixed, majority men","['m', 'm', 'f']",3,1,at least 1 woman,1 or more women in credits,1 or more men,m;f
new_066,3,goodbyes by post malone featuring young thug,2019,1,"mixed, majority men","['m', 'm', 'm', 'f', 'm', 'm', 'm']",7,1,at least 1 woman,1 or more women in credits,1 or more men,m
new_062,5,no guidance by chris brown featuring drake,2019,1,"mixed, majority men","['m', 'm', 'm', 'm', 'm', 'm', 'f', 'm', 'm', 'm']",10,1,at least 1 woman,1 or more women in credits,1 or more men,m
new_075,4,roxanne by arizona zervas,2019,1,"mixed, majority men","['m', 'm', 'm', 'f']",4,1,at least 1 woman,1 or more women in credits,1 or more men,m
new_058,1,truth hurts by lizzo,2019,1,"mixed, majority men","['f', 'f', 'm', 'm', 'm']",5,2,at least 1 woman,1 or more women in credits,1 or more men,f
new_049,2,"break up with your girlfriend, i'm bored by ariana grande",2019,1,"mixed, majority men","['f', 'm', 'f', 'm', 'm', 'm']",6,2,at least 1 woman,1 or more women in credits,1 or more men,f
new_073,1,lose you to love me by selena gomez,2019,1,"mixed, majority men","['f', 'nb', 'm', 'm', 'f']",5,2,at least 1 woman,1 or more women in credits,1 or more men,f
new_064,1,señorita by shawn mendes & camila cabello,2019,1,"mixed, majority men","['f', 'm', 'm', 'f', 'm', 'f', 'm', 'm']",8,3,at least 1 woman,1 or more women in credits,1 or more men,m;f
new_047,1,7 rings by ariana grande,2019,1,"mixed, majority men","['f', 'm', 'f', 'm', 'f', 'm', 'm', 'm', 'nb', 'f']",10,4,at least 1 woman,1 or more women in credits,1 or more men,f
new_034,1,sicko mode by travis scott,2018,1,only men,"['m', 'm', 'm', 'm', 'm', 'm', 'm', 'm', 'm', 'm', 'm', 'm', 'm', 'm', 'm', 'm', 'm', 'm', 'm', 'm', 'm', 'm', 'm', 'm', 'm', 'm', 'm', 'm', 'm', 'm']",30,0,no women,only men,1 or more men,m
new_033,5,"no brainer by dj khaled featuring justin bieber, chance the rapper & quavo",2018,1,only men,"['m', 'm', 'm', 'm', 'm', 'm', 'm', 'm', 'm']",9,0,no women,only men,1 or more men,m
1005307,3,Finesse by Bruno Mars & Cardi B,2018,1,only men,"['m', 'm', 'm', 'm', 'm', 'm', 'm', 'm']",8,0,no women,only men,1 or more men,m;f
new_043,5,mia by bad bunny featuring drake,2018,1,only men,"['m', 'm', 'm', 'm', 'm', 'm', 'm']",7,0,no women,only men,1 or more men,m
new_017,5,look alive by blocboy jb featuring drake,2018,1,only men,"['m', 'm', 'm', 'm', 'm', 'm']",6,0,no women,only men,1 or more men,m
new_025,3,better now by post malone,2018,1,only men,"['m', 'm', 'm', 'm', 'm', 'm']",6,0,no women,only men,1 or more men,m
new_044,1,sunflower by post malone & swae lee,2018,1,only men,"['m', 'm', 'm', 'm', 'm', 'm']",6,0,no women,only men,1 or more men,m
new_027,2,lucid dreams by juice wrld,2018,1,only men,"['m', 'm', 'm', 'm', 'm']",5,0,no women,only men,1 or more men,m
new_038,5,don't cry by lil wayne featuring xxxtentacion,2018,1,only men,"['m', 'm', 'm', 'm', 'm']",5,0,no women,only men,1 or more men,m
1063267,1,God's Plan by Drake,2018,1,only men,"['m', 'm', 'm', 'm', 'm']",5,0,no women,only men,1 or more men,m
new_018,1,psycho by post malone featuring ty dolla $ign,2018,1,only men,"['m', 'm', 'm', 'm']",4,0,no women,only men,1 or more men,m
new_040,2,mona lisa by lil wayne featuring kendrick lamar,2018,1,only men,"['m', 'm', 'm', 'm']",4,0,no women,only men,1 or more men,m
new_021,4,call out my name by the weeknd,2018,1,only men,"['m', 'm', 'm']",3,0,no women,only men,1 or more men,m
new_026,1,this is america by childish gambino,2018,1,only men,"['m', 'm', 'm']",3,0,no women,only men,1 or more men,m
new_035,2,happier by marshmello & bastille,2018,1,only men,"['m', 'm', 'm']",3,0,no women,only men,1 or more men,m
new_037,4,drip too hard by lil baby & gunna,2018,1,only men,"['m', 'm', 'm']",3,0,no women,only men,1 or more men,m
new_019,1,sad! by xxxtentacion,2018,1,only men,"['m', 'm']",2,0,no women,only men,1 or more men,m
new_036,3,killshot by eminem,2018,1,only men,"['m', 'm']",2,0,no women,only men,1 or more men,m
1029084,5,Bad At Love by Halsey,2018,1,only men,"['nb', 'm', 'nb', 'm']",4,0,no women,only men,1 or more men,nb
new_042,2,zeze by kodak black featuring travis scott & offset,2018,1,"mixed, majority men","['f', 'm', 'm', 'm', 'm', 'm', 'm']",7,1,at least 1 woman,1 or more women in credits,1 or more men,m
