title_id,peak_position,song_key,year,since 2000,cut_two,songwriter_gender,song writer count,count of women,cut,has no women,has no men,artist_gender
574380,1,Fire by Ohio Players,1975,0,only men,"['m', 'm', 'm', 'm', 'm', 'm', 'm']",7,0,no women,only men,1 or more men,m
579264,1,Love Rollercoaster by Ohio Players,1975,0,only men,"['m', 'm', 'm', 'm', 'm', 'm', 'm']",7,0,no women,only men,1 or more men,m
570418,1,Pick Up The Pieces by AWB,1975,0,only men,"['m', 'm', 'm', 'm', 'm', 'm']",6,0,no women,only men,1 or more men,m
338181,4,Fight The Power Part 1 by The Isley Brothers,1975,0,only men,"['m', 'm', 'm', 'm', 'm']",5,0,no women,only men,1 or more men,m
337585,5,Heat Wave/love Is A Rose by Linda Ronstadt,1975,0,only men,"['m', 'm', 'm']",3,0,no women,only men,1 or more men,f
338162,1,Jive Talkin' by Bee Gees,1975,0,only men,"['m', 'm', 'm']",3,0,no women,only men,1 or more men,m
345882,5,How Sweet It Is (To Be Loved By You) by James Taylor,1975,0,only men,"['m', 'm', 'm']",3,0,no women,only men,1 or more men,m
346432,1,"Shining Star by Earth, Wind & Fire",1975,0,only men,"['m', 'm', 'm']",3,0,no women,only men,1 or more men,m
570826,1,Please Mr. Postman by Carpenters,1975,0,only men,"['m', 'm', 'm']",3,0,no women,only men,1 or more men,m;f
575357,1,Best Of My Love by Eagles,1975,0,only men,"['m', 'm', 'm']",3,0,no women,only men,1 or more men,m
575823,5,They Just Can't Stop It the (Games People Play) by The Spinners,1975,0,only men,"['m', 'm', 'm']",3,0,no women,only men,1 or more men,m
577092,1,He Don't Love You (Like I Love You) by Tony Orlando & Dawn,1975,0,only men,"['m', 'm', 'm']",3,0,no women,only men,1 or more men,m;f
338220,1,Fame by David Bowie,1975,0,only men,"['m', 'm', 'm']",3,0,no women,only men,1 or more men,m
117188,1,"Fly, Robin, Fly by Silver Convention",1975,0,only men,"['m', 'm']",2,0,no women,only men,1 or more men,f
337530,4,Run Joey Run by David Geddes,1975,0,only men,"['m', 'm']",2,0,no women,only men,1 or more men,m
337586,3,Sky High by Jigsaw,1975,0,only men,"['m', 'm']",2,0,no women,only men,1 or more men,m
337602,1,Bad Blood by Neil Sedaka,1975,0,only men,"['m', 'm']",2,0,no women,only men,1 or more men,m
337641,1,Saturday Night by Bay City Rollers,1975,0,only men,"['m', 'm']",2,0,no women,only men,1 or more men,m
337658,1,Island Girl by Elton John,1975,0,only men,"['m', 'm']",2,0,no women,only men,1 or more men,m
337996,3,Jackie Blue by Ozark Mountain Daredevils,1975,0,only men,"['m', 'm']",2,0,no women,only men,1 or more men,m
338013,3,No No Song/snookeroo by Ringo Starr,1975,0,only men,"['m', 'm']",2,0,no women,only men,1 or more men,m
338048,5,Love Won't Let Me Wait by Major Harris,1975,0,only men,"['m', 'm']",2,0,no women,only men,1 or more men,m
338206,5,Ballroom Blitz by Sweet,1975,0,only men,"['m', 'm']",2,0,no women,only men,1 or more men,m
338596,1,Laughter In The Rain by Neil Sedaka,1975,0,only men,"['m', 'm']",2,0,no women,only men,1 or more men,m
338631,1,Mandy by Barry Manilow,1975,0,only men,"['m', 'm']",2,0,no women,only men,1 or more men,m
346293,1,My Eyes Adored You by Frankie Valli,1975,0,only men,"['m', 'm']",2,0,no women,only men,1 or more men,m
346524,5,Magic by Pilot,1975,0,only men,"['m', 'm']",2,0,no women,only men,1 or more men,m
346615,1,One Of These Nights by Eagles,1975,0,only men,"['m', 'm']",2,0,no women,only men,1 or more men,m
572238,1,Get Down Tonight by KC And The Sunshine Band,1975,0,only men,"['m', 'm']",2,0,no women,only men,1 or more men,m
572440,1,Theme From Mahogany (Do You Know Where You're Going To) by Diana Ross,1975,0,only men,"['m', 'm']",2,0,no women,only men,1 or more men,f
572483,1,(Hey Won't You Play) Another Somebody Done Somebody Wrong Song by B.J. Thomas,1975,0,only men,"['m', 'm']",2,0,no women,only men,1 or more men,m
573084,2,I'm Not In Love by 10cc,1975,0,only men,"['m', 'm']",2,0,no women,only men,1 or more men,m
575526,4,Only Yesterday by Carpenters,1975,0,only men,"['m', 'm']",2,0,no women,only men,1 or more men,m;f
577652,3,Please Mr. Please by Olivia Newton-John,1975,0,only men,"['m', 'm']",2,0,no women,only men,1 or more men,f
577738,1,That's The Way (I Like It) by KC And The Sunshine Band,1975,0,only men,"['m', 'm']",2,0,no women,only men,1 or more men,m
578009,3,Wildfire by Michael Murphey,1975,0,only men,"['m', 'm']",2,0,no women,only men,1 or more men,m
578993,4,Mr. Jaws by Dickie Goodman,1975,0,only men,"['m', 'm']",2,0,no women,only men,1 or more men,m
579685,2,Lyin' Eyes by Eagles,1975,0,only men,"['m', 'm']",2,0,no women,only men,1 or more men,m
580207,1,Love Will Keep Us Together by Captain & Tennille,1975,0,only men,"['m', 'm']",2,0,no women,only men,1 or more men,m;f
580449,1,Philadelphia Freedom by The Elton John Band,1975,0,only men,"['m', 'm']",2,0,no women,only men,1 or more men,m
379699,4,Someone Saved My Life Tonight by Elton John,1975,0,only men,"['m', 'm']",2,0,no women,only men,1 or more men,m
337556,3,Miracles by Jefferson Starship,1975,0,only men,['m'],1,0,no women,only men,1 or more men,m;f
337660,1,Let's Do It Again by The Staple Singers,1975,0,only men,['m'],1,0,no women,only men,1 or more men,m;f
337870,3,Boogie On Reggae Woman by Stevie Wonder,1975,0,only men,['m'],1,0,no women,only men,1 or more men,m
337928,1,You're No Good by Linda Ronstadt,1975,0,only men,['m'],1,0,no women,only men,1 or more men,f
337944,5,Lonely People by America,1975,0,only men,['m'],1,0,no women,only men,1 or more men,m
337990,1,Have You Never Been Mellow by Olivia Newton-John,1975,0,only men,['m'],1,0,no women,only men,1 or more men,f
338042,3,How Long by Ace,1975,0,only men,['m'],1,0,no women,only men,1 or more men,m
338090,1,Thank God I'm A Country Boy by John Denver,1975,0,only men,['m'],1,0,no women,only men,1 or more men,m
338121,2,When Will I Be Loved by Linda Ronstadt,1975,0,only men,['m'],1,0,no women,only men,1 or more men,f
338133,5,Old Days by Chicago,1975,0,only men,['m'],1,0,no women,only men,1 or more men,m
338186,1,Rhinestone Cowboy by Glen Campbell,1975,0,only men,['m'],1,0,no women,only men,1 or more men,m
346349,1,Black Water by The Doobie Brothers,1975,0,only men,['m'],1,0,no women,only men,1 or more men,m
346542,1,Sister Golden Hair by America,1975,0,only men,['m'],1,0,no women,only men,1 or more men,m
364455,1,I'm Sorry by John Denver,1975,0,only men,['m'],1,0,no women,only men,1 or more men,m
571835,5,You Are So Beautiful/It's A Sin When You Love Somebody by Joe Cocker,1975,0,only men,['m'],1,0,no women,only men,1 or more men,m
574440,3,Some Kind Of Wonderful by Grand Funk,1975,0,only men,['m'],1,0,no women,only men,1 or more men,m
578479,4,Bad Time by Grand Funk,1975,0,only men,['m'],1,0,no women,only men,1 or more men,m
579391,3,Junior's Farm/Sally G by Paul McCartney And Wings,1975,0,only men,['m'],1,0,no women,only men,1 or more men,m;f
579835,1,The Hustle by Van McCoy And The Soul City Symphony,1975,0,only men,['m'],1,0,no women,only men,1 or more men,m
359024,5,Chevy Van by Sammy Johns,1975,0,only men,['m'],1,0,no women,only men,1 or more men,m
577228,4,Express by B.T. Express,1975,0,"mixed, majority men","['f', 'm', 'm', 'm', 'm', 'm', 'm']",7,1,at least 1 woman,1 or more women in credits,1 or more men,m;f
346366,1,Lovin' You by Minnie Riperton,1975,0,parity,"['f', 'm']",2,1,at least 1 woman,1 or more women in credits,1 or more men,f
571259,5,Supernatural Thing - Part I by Ben E. King,1975,0,parity,"['f', 'm']",2,1,at least 1 woman,1 or more women in credits,1 or more men,m
572809,1,Listen To What The Man Said by Wings,1975,0,parity,"['f', 'm']",2,1,at least 1 woman,1 or more women in credits,1 or more men,m;f
576722,1,"Fallin' In Love by Hamilton, Joe Frank & Reynolds",1975,0,parity,"['f', 'm']",2,1,at least 1 woman,1 or more women in credits,1 or more men,m
337991,1,Before The Next Teardrop Falls by Freddy Fender,1975,0,parity,"['m', 'f']",2,1,at least 1 woman,1 or more women in credits,1 or more men,m
34463,3,Who Loves You by The 4 Seasons,1975,0,parity,"['m', 'f']",2,1,at least 1 woman,1 or more women in credits,1 or more men,m
337909,1,Lady Marmalade by Labelle,1975,0,"mixed, majority men","['m', 'm', 'f', 'm']",4,1,at least 1 woman,1 or more women in credits,1 or more men,f
337968,5,Poetry Man by Phoebe Snow,1975,0,only women,['f'],1,1,only women,1 or more women in credits,only women,f
338113,4,I'm Not Lisa by Jessi Colter,1975,0,only women,['f'],1,1,only women,1 or more women in credits,only women,f
338191,3,At Seventeen by Janis Ian,1975,0,only women,['f'],1,1,only women,1 or more women in credits,only women,f
571633,4,The Way I Want To Touch You by Captain & Tennille,1975,0,only women,['f'],1,1,only women,1 or more women in credits,only women,m;f
338309,2,Dancing Machine by Jackson 5,1974,0,only men,"['?', 'm', 'm']",3,0,no women,only men,1 or more men,m
570421,4,Jungle Boogie by Kool & The Gang,1974,0,only men,"['m', 'm', 'm', 'm', 'm', 'm', 'm', 'm']",8,0,no women,only men,1 or more men,m
338622,2,"You're The First, The Last, My Everything by Barry White",1974,0,only men,"['m', 'm', 'm']",3,0,no women,only men,1 or more men,m
347372,3,Until You Come Back To Me (That's What I'm Gonna Do) by Aretha Franklin,1974,0,only men,"['m', 'm', 'm']",3,0,no women,only men,1 or more men,f
574030,1,Sunshine On My Shoulders by John Denver,1974,0,only men,"['m', 'm', 'm']",3,0,no women,only men,1 or more men,m
31755,4,The Bitch Is Back by Elton John,1974,0,only men,"['m', 'm']",2,0,no women,only men,1 or more men,m
337910,1,Lucy In The Sky With Diamonds by Elton John,1974,0,only men,"['m', 'm']",2,0,no women,only men,1 or more men,m
338298,5,Oh My My by Ringo Starr,1974,0,only men,"['m', 'm']",2,0,no women,only men,1 or more men,m
338406,1,Rock Your Baby by George McCrae,1974,0,only men,"['m', 'm']",2,0,no women,only men,1 or more men,m
338472,1,Nothing From Nothing by Billy Preston,1974,0,only men,"['m', 'm']",2,0,no women,only men,1 or more men,m
338550,3,My Melody Of Love by Bobby Vinton,1974,0,only men,"['m', 'm']",2,0,no women,only men,1 or more men,m
338871,3,Spiders & Snakes by Jim Stafford,1974,0,only men,"['m', 'm']",2,0,no women,only men,1 or more men,m
338980,1,You're Sixteen by Ringo Starr,1974,0,only men,"['m', 'm']",2,0,no women,only men,1 or more men,m
339005,1,Seasons In The Sun by Terry Jacks,1974,0,only men,"['m', 'm']",2,0,no women,only men,1 or more men,m
346690,1,Bennie And The Jets by Elton John,1974,0,only men,"['m', 'm']",2,0,no women,only men,1 or more men,m
346879,2,Don't Let The Sun Go Down On Me by Elton John,1974,0,only men,"['m', 'm']",2,0,no women,only men,1 or more men,m
573849,1,TSOP (The Sound Of Philadelphia) by MFSB Featuring The Three Degrees,1974,0,only men,"['m', 'm']",2,0,no women,only men,1 or more men,m;f
573940,3,Rock And Roll Heaven by The Righteous Brothers,1974,0,only men,"['m', 'm']",2,0,no women,only men,1 or more men,m
573944,1,"Billy, Don't Be A Hero by Bo Donaldson And The Heywoods",1974,0,only men,"['m', 'm']",2,0,no women,only men,1 or more men,m
575315,1,Then Came You by Dionne Warwicke & Spinners,1974,0,only men,"['m', 'm']",2,0,no women,only men,1 or more men,m;f
577004,4,I'm Leaving It (All) Up To You by Donny & Marie Osmond,1974,0,only men,"['m', 'm']",2,0,no women,only men,1 or more men,m;f
577321,2,When Will I See You Again by The Three Degrees,1974,0,only men,"['m', 'm']",2,0,no women,only men,1 or more men,f
578106,4,I've Got To Use My Imagination by Gladys Knight And The Pips,1974,0,only men,"['m', 'm']",2,0,no women,only men,1 or more men,m;f
580872,1,The Night Chicago Died by Paper Lace,1974,0,only men,"['m', 'm']",2,0,no women,only men,1 or more men,m
580889,3,Smokin' In The Boy's Room by Brownsville Station,1974,0,only men,"['m', 'm']",2,0,no women,only men,1 or more men,m
65106,4,Rikki Don't Lose That Number by Steely Dan,1974,0,only men,"['m', 'm']",2,0,no women,only men,1 or more men,m
56361,1,I Honestly Love You by Olivia Newton-John,1974,0,only men,"['m', 'm']",2,0,no women,only men,1 or more men,f
102878,1,Sundown by Gordon Lightfoot,1974,0,only men,['m'],1,0,no women,only men,1 or more men,m
338316,4,The Show Must Go On by Three Dog Night,1974,0,only men,['m'],1,0,no women,only men,1 or more men,m
338344,5,If You Love Me (let Me Know) by Olivia Newton-John,1974,0,only men,['m'],1,0,no women,only men,1 or more men,f
338351,1,The Streak by Ray Stevens,1974,0,only men,['m'],1,0,no women,only men,1 or more men,m
338422,1,Rock Me Gently by Andy Kim,1974,0,only men,['m'],1,0,no women,only men,1 or more men,m
338439,1,Feel Like Makin' Love by Roberta Flack,1974,0,only men,['m'],1,0,no women,only men,1 or more men,f
338470,1,I Shot The Sheriff by Eric Clapton,1974,0,only men,['m'],1,0,no women,only men,1 or more men,m
338502,4,Tin Man by America,1974,0,only men,['m'],1,0,no women,only men,1 or more men,m
338560,5,Back Home Again by John Denver,1974,0,only men,['m'],1,0,no women,only men,1 or more men,m
338577,1,Kung Fu Fighting by Carl Douglas,1974,0,only men,['m'],1,0,no women,only men,1 or more men,m
338584,1,I Can Help by Billy Swan,1974,0,only men,['m'],1,0,no women,only men,1 or more men,m
338594,5,Longfellow Serenade by Neil Diamond,1974,0,only men,['m'],1,0,no women,only men,1 or more men,m
338615,1,Angie Baby by Helen Reddy,1974,0,only men,['m'],1,0,no women,only men,1 or more men,f
338867,5,Rock On by David Essex,1974,0,only men,['m'],1,0,no women,only men,1 or more men,m
346937,5,Can't Get Enough by Bad Company,1974,0,only men,['m'],1,0,no women,only men,1 or more men,m
493862,1,ANNIE's SONG by John Denver,1974,0,only men,['m'],1,0,no women,only men,1 or more men,m
570417,1,You Haven't Done Nothin by Stevie Wonder,1974,0,only men,['m'],1,0,no women,only men,1 or more men,m
571678,1,You Ain't Seen Nothing Yet/Free Wheelin' by Bachman-Turner Overdrive,1974,0,only men,['m'],1,0,no women,only men,1 or more men,m
571964,2,Do It ('til You're Satisfied) by B.T. Express,1974,0,only men,['m'],1,0,no women,only men,1 or more men,m;f
572346,3,"The Entertainer by Marvin Hamlisch/\The Sting\""""",1974,0,only men,['m'],1,0,no women,only men,1 or more men,m
572590,3,Tell Me Something Good by Rufus Featuring Chaka Khan,1974,0,only men,['m'],1,0,no women,only men,1 or more men,m;f
572814,3,Best Thing That Ever Happened To Me by Gladys Knight And The Pips,1974,0,only men,['m'],1,0,no women,only men,1 or more men,m;f
572843,1,Rock The Boat by The Hues Corporation,1974,0,only men,['m'],1,0,no women,only men,1 or more men,m;f
573033,4,Be Thankful For What You Got by William DeVaughn,1974,0,only men,['m'],1,0,no women,only men,1 or more men,m
573850,1,(You're) Having My Baby by Paul Anka with Odia Coates,1974,0,only men,['m'],1,0,no women,only men,1 or more men,m;f
573894,1,Whatever Gets You Thru The Night by John Lennon With The Plastic Ono Nuclear Band,1974,0,only men,['m'],1,0,no women,only men,1 or more men,m;f
575137,1,Hooked On A Feeling by Blue Swede,1974,0,only men,['m'],1,0,no women,only men,1 or more men,m
575525,1,Dark Lady by Cher,1974,0,only men,['m'],1,0,no women,only men,1 or more men,f
575916,1,Show And Tell by Al Wilson,1974,0,only men,['m'],1,0,no women,only men,1 or more men,m
578759,5,Please Come To Boston by Dave Loggins,1974,0,only men,['m'],1,0,no women,only men,1 or more men,m
581281,4,Americans by Byron MacGregor,1974,0,only men,['m'],1,0,no women,only men,1 or more men,m
581416,1,Love's Theme by Love Unlimited Orchestra,1974,0,only men,['m'],1,0,no women,only men,1 or more men,m
581521,5,Come And Get Your Love by Redbone,1974,0,only men,['m'],1,0,no women,only men,1 or more men,m
581553,5,On And On by Gladys Knight And The Pips,1974,0,only men,['m'],1,0,no women,only men,1 or more men,m;f
60020,1,"Can't Get Enough Of Your Love, Babe by Barry White",1974,0,only men,['m'],1,0,no women,only men,1 or more men,m
338273,4,The Lord's Prayer by Sister Janet Mead,1974,0,only men,['m'],1,0,no women,only men,1 or more men,f
577960,2,Boogie Down by Eddie Kendricks,1974,0,"mixed, majority men","['f', 'm', 'm']",3,1,at least 1 woman,1 or more women in credits,1 or more men,m
338352,1,Band On The Run by Paul McCartney And Wings,1974,0,parity,"['f', 'm']",2,1,at least 1 woman,1 or more women in credits,1 or more men,m;f
338538,2,Jazzman by Carole King,1974,0,parity,"['f', 'm']",2,1,at least 1 woman,1 or more women in credits,1 or more men,f
346742,2,You Make Me Feel Brand New by The Stylistics,1974,0,parity,"['f', 'm']",2,1,at least 1 woman,1 or more women in credits,1 or more men,m
570559,1,The Loco-Motion by Grand Funk,1974,0,parity,"['f', 'm']",2,1,at least 1 woman,1 or more women in credits,1 or more men,m
573899,4,Beach Baby by First Class,1974,0,parity,"['f', 'm']",2,1,at least 1 woman,1 or more women in credits,1 or more men,m
338893,1,The Way We Were by Barbra Streisand,1974,0,"mixed, majority men","['m', 'f', 'm']",3,1,at least 1 woman,1 or more women in credits,1 or more men,f
576129,5,Mockingbird by Carly Simon & James Taylor,1974,0,"mixed, majority men","['m', 'f', 'm']",3,1,at least 1 woman,1 or more women in credits,1 or more men,m;f
57154,1,Cat's In The Cradle by Harry Chapin,1974,0,parity,"['m', 'f']",2,1,at least 1 woman,1 or more women in credits,1 or more men,m
581246,2,The Cisco Kid by War,1973,0,only men,"['m', 'm', 'm', 'm', 'm', 'm', 'm']",7,0,no women,only men,1 or more men,m
338678,4,Smoke On The Water by Deep Purple,1973,0,only men,"['m', 'm', 'm', 'm', 'm']",5,0,no women,only men,1 or more men,m
31659,1,The Joker by The Steve Miller Band,1973,0,only men,"['m', 'm', 'm']",3,0,no women,only men,1 or more men,m
347270,1,The Most Beautiful Girl by Charlie Rich,1973,0,only men,"['m', 'm', 'm']",3,0,no women,only men,1 or more men,m
23788,2,Goodbye Yellow Brick Road by Elton John,1973,0,only men,"['m', 'm']",2,0,no women,only men,1 or more men,m
338679,1,Touch Me In The Morning by Diana Ross,1973,0,only men,"['m', 'm']",2,0,no women,only men,1 or more men,f
338693,1,Brother Louie by Stories,1973,0,only men,"['m', 'm']",2,0,no women,only men,1 or more men,m
338718,1,Delta Dawn by Helen Reddy,1973,0,only men,"['m', 'm']",2,0,no women,only men,1 or more men,f
338816,1,Angie by The Rolling Stones,1973,0,only men,"['m', 'm']",2,0,no women,only men,1 or more men,m
338840,1,Photograph by Ringo Starr,1973,0,only men,"['m', 'm']",2,0,no women,only men,1 or more men,m
339071,2,Playground In My Mind by Clint Holmes,1973,0,only men,"['m', 'm']",2,0,no women,only men,1 or more men,m
339077,2,Daniel by Elton John,1973,0,only men,"['m', 'm']",2,0,no women,only men,1 or more men,m
339088,1,Will It Go Round In Circles by Billy Preston,1973,0,only men,"['m', 'm']",2,0,no women,only men,1 or more men,m
347163,1,Let's Get It On by Marvin Gaye,1973,0,only men,"['m', 'm']",2,0,no women,only men,1 or more men,m
390306,1,Crocodile Rock by Elton John,1973,0,only men,"['m', 'm']",2,0,no women,only men,1 or more men,m
46115,1,Killing Me Softly With His Song by Roberta Flack,1973,0,only men,"['m', 'm']",2,0,no women,only men,1 or more men,f
571540,1,Tie A Yellow Ribbon Round The Ole Oak Tree by Dawn Featuring Tony Orlando,1973,0,only men,"['m', 'm']",2,0,no women,only men,1 or more men,m;f
572046,4,Your Mama Don't Dance by Kenny Loggins & Jim Messina,1973,0,only men,"['m', 'm']",2,0,no women,only men,1 or more men,m
572545,4,Could It Be I'm Falling In Love by The Spinners,1973,0,only men,"['m', 'm']",2,0,no women,only men,1 or more men,m
572753,3,Little Willy by The Sweet,1973,0,only men,"['m', 'm']",2,0,no women,only men,1 or more men,m
572846,1,Top Of The World by Carpenters,1973,0,only men,"['m', 'm']",2,0,no women,only men,1 or more men,m;f
573323,2,Dueling Banjos by Deliverance/Eric Weissberg & Steve Mandell,1973,0,only men,"['m', 'm']",2,0,no women,only men,1 or more men,m
574997,3,"Say, Has Anybody Seen My Sweet Gypsy Rose by Dawn Featuring Tony Orlando",1973,0,only men,"['m', 'm']",2,0,no women,only men,1 or more men,m;f
575438,2,Also Sprach Zarathustra (2001) by Deodato,1973,0,only men,"['m', 'm']",2,0,no women,only men,1 or more men,m
576217,1,Love Train by The O'Jays,1973,0,only men,"['m', 'm']",2,0,no women,only men,1 or more men,m
577736,4,Ain't No Woman (Like The One I've Got) by Four Tops,1973,0,only men,"['m', 'm']",2,0,no women,only men,1 or more men,m
577959,2,Yesterday Once More by Carpenters,1973,0,only men,"['m', 'm']",2,0,no women,only men,1 or more men,m;f
579080,3,Heartbeat - It's A Lovebeat by The DeFranco Family featuring Tony DeFranco,1973,0,only men,"['m', 'm']",2,0,no women,only men,1 or more men,m;f
579584,1,The Morning After by Maureen McGovern,1973,0,only men,"['m', 'm']",2,0,no women,only men,1 or more men,f
24102,5,Hello It's Me by Todd Rundgren,1973,0,only men,['m'],1,0,no women,only men,1 or more men,m
338663,3,Shambala by Three Dog Night,1973,0,only men,['m'],1,0,no women,only men,1 or more men,m
338665,2,Kodachrome by Paul Simon,1973,0,only men,['m'],1,0,no women,only men,1 or more men,m
338787,4,Higher Ground by Stevie Wonder,1973,0,only men,['m'],1,0,no women,only men,1 or more men,m
338843,4,Space Race by Billy Preston,1973,0,only men,['m'],1,0,no women,only men,1 or more men,m
339111,1,"Bad, Bad Leroy Brown by Jim Croce",1973,0,only men,['m'],1,0,no women,only men,1 or more men,m
347422,1,You Are The Sunshine Of My Life by Stevie Wonder,1973,0,only men,['m'],1,0,no women,only men,1 or more men,m
347424,5,Drift Away by Dobie Gray,1973,0,only men,['m'],1,0,no women,only men,1 or more men,m
390264,4,Just You 'n' Me by Chicago,1973,0,only men,['m'],1,0,no women,only men,1 or more men,m
570788,1,The Night The Lights Went Out In Georgia by Vicki Lawrence,1973,0,only men,['m'],1,0,no women,only men,1 or more men,f
571153,2,Ramblin Man by The Allman Brothers Band,1973,0,only men,['m'],1,0,no women,only men,1 or more men,m
571319,2,Loves Me Like A Rock by Paul Simon (with The Dixie Hummingbirds),1973,0,only men,['m'],1,0,no women,only men,1 or more men,m
572403,3,"Oh, Babe, What Would You Say? by Hurricane Smith",1973,0,only men,['m'],1,0,no women,only men,1 or more men,m
572481,1,We're An American Band by Grand Funk,1973,0,only men,['m'],1,0,no women,only men,1 or more men,m
573518,3,Last Song by Edward Bear,1973,0,only men,['m'],1,0,no women,only men,1 or more men,m
573762,1,Superstition by Stevie Wonder,1973,0,only men,['m'],1,0,no women,only men,1 or more men,m
574438,1,Give Me Love - (Give Me Peace On Earth) by George Harrison,1973,0,only men,['m'],1,0,no women,only men,1 or more men,m
574646,2,Neither One Of Us (Wants To Be The First To Say Goodbye) by Gladys Knight And The Pips,1973,0,only men,['m'],1,0,no women,only men,1 or more men,m;f
575777,1,Midnight Train To Georgia by Gladys Knight And The Pips,1973,0,only men,['m'],1,0,no women,only men,1 or more men,m;f
578663,3,Sing by Carpenters,1973,0,only men,['m'],1,0,no women,only men,1 or more men,m;f
578794,2,Live And Let Die by Wings,1973,0,only men,['m'],1,0,no women,only men,1 or more men,m;f
580106,3,Why Can't We Live Together by Timmy Thomas,1973,0,only men,['m'],1,0,no women,only men,1 or more men,m
581216,1,Frankenstein by Edgar Winter Group,1973,0,only men,['m'],1,0,no women,only men,1 or more men,m
672043,3,I'm Gonna Love You Just A Little More Baby by Barry White,1973,0,only men,['m'],1,0,no women,only men,1 or more men,m
384152,1,Time In A Bottle by Jim Croce,1973,0,only men,['m'],1,0,no women,only men,1 or more men,m
578914,1,Keep On Truckin' (Part 1) by Eddie Kendricks,1973,0,"mixed, majority men","['f', 'm', 'm']",3,1,at least 1 woman,1 or more women in credits,1 or more men,m
339099,1,My Love by Paul McCartney And Wings,1973,0,parity,"['f', 'm']",2,1,at least 1 woman,1 or more women in credits,1 or more men,m;f
347408,5,Break Up To Make Up by The Stylistics,1973,0,"mixed, majority men","['m', 'f', 'm']",3,1,at least 1 woman,1 or more women in credits,1 or more men,m
338832,5,Paper Roses by Marie Osmond,1973,0,parity,"['m', 'f']",2,1,at least 1 woman,1 or more women in credits,1 or more men,f
574385,1,Half-Breed by Cher,1973,0,parity,"['m', 'f']",2,1,at least 1 woman,1 or more women in credits,1 or more men,f
338902,3,Leave Me Alone (ruby Red Dress) by Helen Reddy,1973,0,only women,['f'],1,1,only women,1 or more women in credits,only women,f
339079,3,Pillow Talk by Sylvia (r&b),1973,0,only women,['f'],1,1,only women,1 or more women in credits,only women,f
572445,5,Funny Face by Donna Fargo,1973,0,only women,['f'],1,1,only women,1 or more women in credits,only women,f
571228,3,The Lion Sleeps Tonight by Robert John,1972,0,only men,"['m', 'm', 'm', 'm', 'mixed', 'm']",6,0,no women,only men,1 or more men,m
32740,1,Let's Stay Together by Al Green,1972,0,only men,"['m', 'm', 'm']",3,0,no women,only men,1 or more men,m
398796,3,I'm Still In Love With You by Al Green,1972,0,only men,"['m', 'm', 'm']",3,0,no women,only men,1 or more men,m
45315,4,Look What You Done For Me by Al Green,1972,0,only men,"['m', 'm', 'm']",3,0,no women,only men,1 or more men,m
570560,3,Back Stabbers by The O'Jays,1972,0,only men,"['m', 'm', 'm']",3,0,no women,only men,1 or more men,m
573978,4,Down By The Lazy River by The Osmonds,1972,0,only men,"['m', 'm', 'm']",3,0,no women,only men,1 or more men,m
575967,3,You Ought To Be With Me by Al Green,1972,0,only men,"['m', 'm', 'm']",3,0,no women,only men,1 or more men,m
577695,1,Me And Mrs. Jones by Billy Paul,1972,0,only men,"['m', 'm', 'm']",3,0,no women,only men,1 or more men,m
579542,2,Long Cool Woman (In A Black Dress) by The Hollies,1972,0,only men,"['m', 'm', 'm']",3,0,no women,only men,1 or more men,m
580501,3,Everybody Plays The Fool by The Main Ingredient,1972,0,only men,"['m', 'm', 'm']",3,0,no women,only men,1 or more men,m
24118,3,I'll Be Around by The Spinners,1972,0,only men,"['m', 'm']",2,0,no women,only men,1 or more men,m
415790,5,Hold Your Head Up by Argent,1972,0,only men,"['m', 'm']",2,0,no women,only men,1 or more men,m
