title,artist_name,writer,gender,year,writer_is_artist,artist_gender,title_artist_name,Songwriter is Artist
We Can't Stop,Miley Cyrus,Douglas L. Davis,m,2013,,nb,We Can't Stop by Miley Cyrus,
The Reason,Hoobastank,Douglas Robb,m,2004,,m,The Reason by Hoobastank,
Summer Girls,LFO,Dow Brain,m,1999,,m,Summer Girls by LFO,
Livin' La Vida Loca,Ricky Martin,"Draco Cornelius \Robi\"" Rosa""",m,1999,,m,Livin' La Vida Loca by Ricky Martin,
She's All I Ever Had,Ricky Martin,"Draco Cornelius \Robi\"" Rosa""",m,1999,,m,She's All I Ever Had by Ricky Martin,
Thong Song,Sisqo,"Draco Cornelius \Robi\"" Rosa""",m,2000,,m,Thong Song by Sisqo,
Sicko Mode,Travis Scott,Drake,m,2018,,m,Sicko Mode by Travis Scott,
Wait For U,Future Featuring Drake & Tems,DRAKE AUBREY,m,2022,,m;f,Wait For U by Future Featuring Drake & Tems,
Heartless,The Weeknd,Dre Moon,m,2019,,m,Heartless by The Weeknd,
Forever After All,Luke Combs,DREW PARKER,m,2020,,m,Forever After All by Luke Combs,
Da Ya Think I'm Sexy?,Rod Stewart,Duane Hitchings,m,1979,,m,Da Ya Think I'm Sexy? by Rod Stewart,
Young Turks,Rod Stewart,Duane Hitchings,m,1981,,m,Young Turks by Rod Stewart,
Laugh Now Cry Later,Drake Featuring Lil Durk,DURK D BANKS,m,2020,,m,Laugh Now Cry Later by Drake Featuring Lil Durk,
BedRock,Young Money Featuring Lloyd,"Dwayne \Lil Wayne\"" Carter""",m,2010,,m,BedRock by Young Money Featuring Lloyd,
Best I Ever Had,Drake,"Dwayne \Lil Wayne\"" Carter""",m,2009,,m,Best I Ever Had by Drake,
Down,Jay Sean Featuring Lil Wayne,"Dwayne \Lil Wayne\"" Carter""",m,2009,,m,Down by Jay Sean Featuring Lil Wayne,
Grillz,"Nelly Featuring Paul Wall, Ali & Gipp","Dwayne \Lil Wayne\"" Carter""",m,2005,,m,"Grillz by Nelly Featuring Paul Wall, Ali & Gipp",
How To Love,Lil Wayne,"Dwayne \Lil Wayne\"" Carter""",m,2011,,m,How To Love by Lil Wayne,
I'm The One,"DJ Khaled Featuring Justin Bieber, Quavo, Chance The Rapper & Lil Wayne","Dwayne \Lil Wayne\"" Carter""",m,2017,,m,"I'm The One by DJ Khaled Featuring Justin Bieber, Quavo, Chance The Rapper & Lil Wayne",
Let It Rock,Kevin Rudolf Featuring Lil Wayne,"Dwayne \Lil Wayne\"" Carter""",m,2008,,m,Let It Rock by Kevin Rudolf Featuring Lil Wayne,
Lollipop,Lil Wayne Featuring Static Major,"Dwayne \Lil Wayne\"" Carter""",m,2008,,m,Lollipop by Lil Wayne Featuring Static Major,
She Will,Lil Wayne Featuring Drake,"Dwayne \Lil Wayne\"" Carter""",m,2011,,m,She Will by Lil Wayne Featuring Drake,
Soldier,Destiny's Child Featuring T.I. & Lil Wayne,"Dwayne \Lil Wayne\"" Carter""",m,2005,,m;f,Soldier by Destiny's Child Featuring T.I. & Lil Wayne,
Swagga Like Us,Jay-Z & T.I. Featuring Kanye West & Lil Wayne,"Dwayne \Lil Wayne\"" Carter""",m,2008,,m,Swagga Like Us by Jay-Z & T.I. Featuring Kanye West & Lil Wayne,
Don't Cry,Lil Wayne Featuring XXXTENTACION,DWAYNE CARTER,m,2018,,m,Don't Cry by Lil Wayne Featuring XXXTENTACION,
Mona Lisa,Lil Wayne Featuring Kendrick Lamar,DWAYNE CARTER,m,2018,,m,Mona Lisa by Lil Wayne Featuring Kendrick Lamar,
Whats Poppin,"Jack Harlow Featuring DaBaby, Tory Lanez & Lil Wayne",DWAYNE CARTER,m,2020,,m,"Whats Poppin by Jack Harlow Featuring DaBaby, Tory Lanez & Lil Wayne",
Wants And Needs,Drake Featuring Lil Baby,Dylan Cleary-Krell,m,2021,,m,Wants And Needs by Drake Featuring Lil Baby,
Major Distribution,Drake & 21 Savage,E. Ferrara,m,2022,,m,Major Distribution by Drake & 21 Savage,
Major Distribution,Drake & 21 Savage,E. Fox-Peck,m,2022,,m,Major Distribution by Drake & 21 Savage,
I Need A Girl (Part One),P. Diddy Featuring Usher & Loon,E. Matlock,m,2002,,m,I Need A Girl (Part One) by P. Diddy Featuring Usher & Loon,
Make Me Lose Control,Eric Carmen,E.Carmen,m,1988,,m,Make Me Lose Control by Eric Carmen,
Rhythm Is Gonna Get You,Gloria Estefan & Miami Sound Machine,E.E.Garcia,m,1987,,m;f,Rhythm Is Gonna Get You by Gloria Estefan & Miami Sound Machine,
Do Anything,Natural Selection,E.Erickson,m,1991,,m,Do Anything by Natural Selection,
1-2-2003,Gloria Estefan & Miami Sound Machine,E.Garcia,m,1988,,m;f,37623 by Gloria Estefan & Miami Sound Machine,
Gangsta Lean,DRS,E.J.Turner,m,1993,,m,Gangsta Lean by DRS,
Informer,Snow,E.Leary,m,1993,,m,Informer by Snow,
Little Lies,Fleetwood Mac,E.Quintela,m,1987,,m;f,Little Lies by Fleetwood Mac,
Have You Seen Her,M.C. Hammer,E.Record,m,1990,,m,Have You Seen Her by M.C. Hammer,
Jump Around,House Of Pain,E.Schrody,m,1992,,m,Jump Around by House Of Pain,
Stutter,Joe Featuring Mystikal,E.Wilcox,m,2001,,m,Stutter by Joe Featuring Mystikal,
Duke Of Earl,Gene Chandler,Earl Edwards,m,1962,,m,Duke Of Earl by Gene Chandler,
Celebration,Kool & The Gang,Earl Eugene Toon Jr.,m,1981,,m,Celebration by Kool & The Gang,
No Limit,G-Eazy Featuring A$AP Rocky & Cardi B,Earl Patrick Taylor,m,2018,,m;f,No Limit by G-Eazy Featuring A$AP Rocky & Cardi B,
Black & White,Three Dog Night,Earl Robinson,m,1972,,m,Black & White by Three Dog Night,
Hey There Lonely Girl,Eddie Holman,Earl Shuman,m,1970,,m,Hey There Lonely Girl by Eddie Holman,
Hotel Happiness,Brook Benton,Earl Shuman,m,1963,,m,Hotel Happiness by Brook Benton,
This Is Why I'm Hot,Mims,"Earl T. \E-40\"" Stevens""",m,2007,,m,This Is Why I'm Hot by Mims,
Ice Ice Baby,Vanilla Ice,Earthquake,m,1990,,m,Ice Ice Baby by Vanilla Ice,
Sicko Mode,Travis Scott,Easy Mo Bee,m,2018,,m,Sicko Mode by Travis Scott,
Crystal Blue Persuasion,Tommy James And The Shondells,Ed Gray,m,1969,,m,Crystal Blue Persuasion by Tommy James And The Shondells,
Venus,Frankie Avalon,Ed Marshall,m,1959,,m,Venus by Frankie Avalon,
One Week,Barenaked Ladies,Ed Robertson,m,1998,,m,One Week by Barenaked Ladies,
I Keep Forgettin' (Every Time You're Near),Michael McDonald,Ed Sanford,m,1982,,m,I Keep Forgettin' (Every Time You're Near) by Michael McDonald,
Permission To Dance,BTS,Ed Sheeran,m,2021,,m,Permission To Dance by BTS,
Let's Get It On,Marvin Gaye,Ed Townsend,m,1973,,m,Let's Get It On by Marvin Gaye,
When It's Love,Van Halen,Eddie,m,1988,,m,When It's Love by Van Halen,
Groovin',The Young Rascals,Eddie Brigati,m,1967,,m,Groovin' by The Young Rascals,
People Got To Be Free,The Rascals,Eddie Brigati,m,1968,,m,People Got To Be Free by The Rascals,
A Beautiful Morning,The Rascals,Eddie Brigati Jr.,m,1968,,m,A Beautiful Morning by The Rascals,
Too Late To Turn Back Now,Cornelius Brothers & Sister Rose,Eddie Cornelius,m,1972,,m;f,Too Late To Turn Back Now by Cornelius Brothers & Sister Rose,
Treat Her Like A Lady,Cornelius Brothers & Sister Rose,Eddie Cornelius,m,1971,,m;f,Treat Her Like A Lady by Cornelius Brothers & Sister Rose,
Angel,Shaggy Featuring Rayvon,Eddie Curtis,m,2001,,m,Angel by Shaggy Featuring Rayvon,
The Joker,The Steve Miller Band,Eddie Curtis,m,1973,,m,The Joker by The Steve Miller Band,
Beauty Is Only Skin Deep,The Temptations,Eddie Holland,m,1966,,m,Beauty Is Only Skin Deep by The Temptations,
I Can't Help Myself (Sugar Pie Honey Bunch),Four Tops,Eddie Holland,m,1965,,m,I Can't Help Myself (Sugar Pie Honey Bunch) by Four Tops,
Reach Out I'll Be There,Four Tops,Eddie Holland,m,1966,,m,Reach Out I'll Be There by Four Tops,
Baby I Need Your Lovin',Johnny Rivers,Eddie Holland Jr.,m,1967,,m,Baby I Need Your Lovin' by Johnny Rivers,
Bernadette,Four Tops,Eddie Holland Jr.,m,1967,,m,Bernadette by Four Tops,
How Sweet It Is (To Be Loved By You),James Taylor,Eddie Holland Jr.,m,1975,,m,How Sweet It Is (To Be Loved By You) by James Taylor,
It's The Same Old Song,Four Tops,Eddie Holland Jr.,m,1965,,m,It's The Same Old Song by Four Tops,
Release Me (And Let Me Love Again),Engelbert Humperdinck,Eddie Miller,m,1967,,m,Release Me (And Let Me Love Again) by Engelbert Humperdinck,
Strangers In The Night,Frank Sinatra,Eddie Snyder,m,1966,,m,Strangers In The Night by Frank Sinatra,
You Don't Know Me,Ray Charles,Eddy Arnold,m,1962,,m,You Don't Know Me by Ray Charles,
I Like It,"Cardi B, Bad Bunny & J Balvin",Edgar Machuca,m,2018,,m;f,"I Like It by Cardi B, Bad Bunny & J Balvin",
I Like It,"Cardi B, Bad Bunny & J Balvin",Edgar Semper Vargas,m,2018,,m;f,"I Like It by Cardi B, Bad Bunny & J Balvin",
MIA,Bad Bunny Featuring Drake,EDGAR WILMER SEMPER-VARGAS,m,2018,,m,MIA by Bad Bunny Featuring Drake,
U Remind Me,Usher,Edmund Clement,m,2001,,m,U Remind Me by Usher,
Cold Water,Major Lazer Featuring Justin Bieber & MO,"Edward \Ed\"" Christopher Sheeran""",m,2016,,m;f,Cold Water by Major Lazer Featuring Justin Bieber & MO,
Love Yourself,Justin Bieber,"Edward \Ed\"" Christopher Sheeran""",m,2015,,m,Love Yourself by Justin Bieber,
Perfect,Ed Sheeran,"Edward \Ed\"" Christopher Sheeran""",m,2017,,m,Perfect by Ed Sheeran,
Shape Of You,Ed Sheeran,"Edward \Ed\"" Christopher Sheeran""",m,2017,,m,Shape Of You by Ed Sheeran,
Thinking Out Loud,Ed Sheeran,"Edward \Ed\"" Christopher Sheeran""",m,2015,,m,Thinking Out Loud by Ed Sheeran,
Best Song Ever,One Direction,"Edward \Ed\"" Drewett""",m,2013,,m,Best Song Ever by One Direction,
Glad You Came,The Wanted,"Edward \Ed\"" Drewett""",m,2012,,m,Glad You Came by The Wanted,
No More,Ruff Endz,"Edward \Eddie F\"" Ferrell""",m,2000,,m,No More by Ruff Endz,
How Can I Be Sure,The Young Rascals,Edward Brigati Jr.,m,1967,,m,How Can I Be Sure by The Young Rascals,
Bad Habits,Ed Sheeran,EDWARD CHRISTOPHER SHEERAN,m,2021,,m,Bad Habits by Ed Sheeran,
I Don't Care,Ed Sheeran & Justin Bieber,EDWARD CHRISTOPHER SHEERAN,m,2019,,m,I Don't Care by Ed Sheeran & Justin Bieber,
Shivers,Ed Sheeran,EDWARD CHRISTOPHER SHEERAN,m,2021,,m,Shivers by Ed Sheeran,
Dazz,Brick,Edward Irons,m,1977,,m,Dazz by Brick,
It's The Most Wonderful Time Of The Year,Andy Williams,EDWARD POLA,m,2021,,m,It's The Most Wonderful Time Of The Year by Andy Williams,
Drivin' My Life Away,Eddie Rabbitt,EDWARD T RABBITT,m,1980,,m,Drivin' My Life Away by Eddie Rabbitt,
I Like The Way (The Kissing Game),Hi-Five,"Edward Theodore \Teddy\"" Riley""",m,1991,,m,I Like The Way (The Kissing Game) by Hi-Five,
I Want Her,Keith Sweat,"Edward Theodore \Teddy\"" Riley""",m,1988,,m,I Want Her by Keith Sweat,
No Diggity,BLACKstreet (Featuring Dr. Dre),"Edward Theodore \Teddy\"" Riley""",m,1996,,m;f,No Diggity by BLACKstreet (Featuring Dr. Dre),
Remember The Time,Michael Jackson,"Edward Theodore \Teddy\"" Riley""",m,1992,,m,Remember The Time by Michael Jackson,
Step By Step,Eddie Rabbitt,EDWARD THOMAS RABBITT,m,1981,,m,Step By Step by Eddie Rabbitt,
Jump,Van Halen,Edward Van Halen,m,1984,,m,Jump by Van Halen,
Why Can't This Be Love,Van Halen,Edward Van Halen,m,1986,,m,Why Can't This Be Love by Van Halen,
Stronger,Kanye West,Edwin Birdsong,m,2007,,m,Stronger by Kanye West,
Oh Happy Day,The Edwin Hawkins' Singers Featuring Dorothy Combs Morrison,Edwin R. Hawkins,m,1969,,m;f,Oh Happy Day by The Edwin Hawkins' Singers Featuring Dorothy Combs Morrison,
Give Me Just A Little More Time,Chairman Of The Board,Edythe Wayne,m,1970,,m,Give Me Just A Little More Time by Chairman Of The Board,
Wake Me Up!,Avicii,"Egbert Nathaniel \Aloe Blacc\"" Dawkins III""",m,2013,,m,Wake Me Up! by Avicii,
Rapstar,Polo G,Einer Bankz,m,2021,,m,Rapstar by Polo G,
It's Ecstasy When You Lay Down Next To Me,Barry White,Ekundayo Paris,m,1977,,m,It's Ecstasy When You Lay Down Next To Me by Barry White,
My Place,Nelly Featuring Jaheim,El Debarge,m,2004,,m,My Place by Nelly Featuring Jaheim,
Ride Wit Me,Nelly Featuring City Spud,El Debarge,m,2001,,m,Ride Wit Me by Nelly Featuring City Spud,
Differences,Ginuwine,"Elgin \Ginuwine\"" Lumpkin""",m,2001,,m;f,Differences by Ginuwine,
Love Won't Let Me Wait,Major Harris,Eli,m,1975,,m,Love Won't Let Me Wait by Major Harris,
Shut Up And Dance,WALK THE MOON,Eli Maiman,m,2015,,m,Shut Up And Dance by WALK THE MOON,
Popstar,DJ Khaled Featuring Drake,ELIAS KLUGHAMMER,m,2020,,m,Popstar by DJ Khaled Featuring Drake,
Move Ya Body,Nina Sky Featuring Jabba,Elijah Wells,m,2004,,m;f,Move Ya Body by Nina Sky Featuring Jabba,
Lavender-Blue,Sammy Turner,Eliot Daniel,m,1959,,m,Lavender-Blue by Sammy Turner,
Simon Says,1910 Fruitgum Co.,Elliot Chiprut,m,1968,,m,Simon Says by 1910 Fruitgum Co.,
Brandy (You're A Fine Girl),Looking Glass,Elliot Lurie,m,1972,,m,Brandy (You're A Fine Girl) by Looking Glass,
Got To Be There,Michael Jackson,Elliot Willensky,m,1971,,m,Got To Be There by Michael Jackson,
Armageddon It,Def Leppard,Elliott,m,1989,,m,Armageddon It by Def Leppard,
Love Bites,Def Leppard,Elliott,m,1988,,m,Love Bites by Def Leppard,
Pour Some Sugar On Me,Def Leppard,Elliott,m,1988,,m,Pour Some Sugar On Me by Def Leppard,
Poison,Bell Biv DeVoe,Elliott Straite,m,1990,,m,Poison by Bell Biv DeVoe,
FourFiveSeconds,Rihanna & Kanye West & Paul McCartney,Elon Rutberg,m,2015,,m;f,FourFiveSeconds by Rihanna & Kanye West & Paul McCartney,
Grazing In The Grass,Hugh Masekela,Elston Harry,m,1968,,m,Grazing In The Grass by Hugh Masekela,
No No Song/snookeroo,Ringo Starr,Elton John,m,1975,,m,No No Song/snookeroo by Ringo Starr,
First Class,Jack Harlow,ELVIS LEE JR WILLIAMS,m,2022,,m,First Class by Jack Harlow,
Don't Be Cruel,Cheap Trick,Elvis Presley,m,1988,,m,Don't Be Cruel by Cheap Trick,
Glamorous,Fergie Featuring Ludacris,Elvis Williams,m,2007,,m;f,Glamorous by Fergie Featuring Ludacris,
Crush,David Archuleta,"Emanuel \Eman\"" Kiriakou""",m,2008,,m,Crush by David Archuleta,
(We Ain't Got) Nothin' Yet,Blues Magoos,Emil Thielhelm,m,1967,,m,(We Ain't Got) Nothin' Yet by Blues Magoos,
The Hills,The Weeknd,Emmanuel Nickerson,m,2015,,m,The Hills by The Weeknd,
Traces,Classics IV Featuring Dennis Yost,Emory Gordy Jr.,m,1969,,m,Traces by Classics IV Featuring Dennis Yost,
"The Good, The Bad And The Ugly","Hugo Montenegro, His Orchestra And Chorus",Ennio Morricone,m,1968,,m,"The Good, The Bad And The Ugly by Hugo Montenegro, His Orchestra And Chorus",
Express,B.T. Express,Ennis Rowe,m,1975,,m;f,Express by B.T. Express,
Be With You,Enrique Iglesias,Enrique M. Iglesias,m,2000,,m,Be With You by Enrique Iglesias,
Hero,Enrique Iglesias,Enrique M. Iglesias,m,2001,,m,Hero by Enrique Iglesias,
I Like It,Enrique Iglesias Featuring Pitbull,Enrique M. Iglesias,m,2010,,m,I Like It by Enrique Iglesias Featuring Pitbull,
Tonight (I'm Lovin' You),Enrique Iglesias Featuring Ludacris & DJ Frank E,Enrique M. Iglesias,m,2011,,m,Tonight (I'm Lovin' You) by Enrique Iglesias Featuring Ludacris & DJ Frank E,
Go All The Way,Raspberries,Eric Carmen,m,1972,,m,Go All The Way by Raspberries,
That's Rock 'N' Roll,Shaun Cassidy,Eric Carmen,m,1977,,m,That's Rock 'N' Roll by Shaun Cassidy,
I Feel It Coming,The Weeknd Featuring Daft Punk,Eric Chedeville,m,2017,,m,I Feel It Coming by The Weeknd Featuring Daft Punk,
Sunshine Of Your Love,Cream,Eric Clapton,m,1968,,m,Sunshine Of Your Love by Cream,
Crack A Bottle,"Eminem, Dr. Dre & 50 Cent",Eric Coomes,m,2009,,m,"Crack A Bottle by Eminem, Dr. Dre & 50 Cent",
Bad At Love,Halsey,Eric Frederic,m,2018,,nb,Bad At Love by Halsey,
Talk Dirty,Jason Derulo Featuring 2 Chainz,Eric Frederic,m,2014,,m,Talk Dirty by Jason Derulo Featuring 2 Chainz,
Wiggle,Jason Derulo Featuring Snoop Dogg,Eric Frederic,m,2014,,m,Wiggle by Jason Derulo Featuring Snoop Dogg,
Heartbeat,Don Johnson,Eric Kaz,m,1986,,m,Heartbeat by Don Johnson,
To Be With You,Mr. Big,Eric Martin,m,1992,,m,To Be With You by Mr. Big,
Twisted,Keith Sweat,Eric McCaine,m,1996,,m,Twisted by Keith Sweat,
Eye In The Sky,The Alan Parsons Project,ERIC NORMAN WOOLFSON,m,1982,,m,Eye In The Sky by The Alan Parsons Project,
Get Low,Lil Jon & The East Side Boyz Featuring Ying Yang Twins,Eric Roderick Von Jr Jackson,m,2003,,m,Get Low by Lil Jon & The East Side Boyz Featuring Ying Yang Twins,
I'm Not In Love,10cc,Eric Stewart,m,1975,,m,I'm Not In Love by 10cc,
The Things We Do For Love,10cc,Eric Stewart,m,1977,,m,The Things We Do For Love by 10cc,
Creepin',"Metro Boomin, The Weeknd & 21 Savage",ERICK S SERMON,m,2022,,m,"Creepin' by Metro Boomin, The Weeknd & 21 Savage",
I Don't Wanna Know,Mario Winans Featuring Enya & P. Diddy,Erick Sermon,m,2004,,m;f,I Don't Wanna Know by Mario Winans Featuring Enya & P. Diddy,
Walk Right In,The Rooftop Singers,Erik Darling,m,1963,,m;f,Walk Right In by The Rooftop Singers,
Spirit In The Sky,Norman Greenbaum,Erik Jacobsen,m,1970,,m,Spirit In The Sky by Norman Greenbaum,
No Air,Jordin Sparks Duet With Chris Brown,Erik Roger Griggs,m,2008,,m;f,No Air by Jordin Sparks Duet With Chris Brown,
Does Your Chewing Gum Lose It's Flavor (On The Bedpost Over Night),Lonnie Donegan And His Skiffle Group,Ernest Brewer,m,1961,,m,Does Your Chewing Gum Lose It's Flavor (On The Bedpost Over Night) by Lonnie Donegan And His Skiffle Group,
Find Your Love,Drake,"Ernest Dion \No I.D\"" Wilson""",m,2010,,m,Find Your Love by Drake,
Heartless,Kanye West,"Ernest Dion \No I.D\"" Wilson""",m,2008,,m,Heartless by Kanye West,
Holy Grail,Jay Z Featuring Justin Timberlake,"Ernest Dion \No I.D\"" Wilson""",m,2013,,m,Holy Grail by Jay Z Featuring Justin Timberlake,
Let Me Hold You,Bow Wow Featuring Omarion,"Ernest Dion \No I.D\"" Wilson""",m,2005,,m,Let Me Hold You by Bow Wow Featuring Omarion,
Run This Town,"Jay-Z, Rihanna & Kanye West","Ernest Dion \No I.D\"" Wilson""",m,2009,,m;f,"Run This Town by Jay-Z, Rihanna & Kanye West",
Stutter,Joe Featuring Mystikal,Ernest Dixson,m,2001,,m,Stutter by Joe Featuring Mystikal,
Exodus,Ferrante & Teicher,Ernest Gold,m,1960,,m,Exodus by Ferrante & Teicher,
Fight The Power Part 1,The Isley Brothers,Ernest Isley,m,1975,,m,Fight The Power Part 1 by The Isley Brothers,
You Proof,Morgan Wallen,ERNEST KEITH SMITH,m,2022,,m,You Proof by Morgan Wallen,
Into You,Fabolous Featuring Tamia Or Ashanti,Ernest Shaw,m,2003,,m;f,Into You by Fabolous Featuring Tamia Or Ashanti,
Lovers Who Wander,Dion,Ernie Maresca,m,1962,,m,Lovers Who Wander by Dion,
Runaround Sue,Dion,Ernie Maresca,m,1961,,m,Runaround Sue by Dion,
The Wanderer,Dion,Ernie Maresca,m,1962,,m,The Wanderer by Dion,
You Sexy Thing,Hot Chocolate,Errol A.G. Brown,m,1976,,m,You Sexy Thing by Hot Chocolate,
Brother Louie,Stories,Errol Brown,m,1973,,m,Brother Louie by Stories,
"Hey, Soul Sister",Train,Espen Lind,m,2010,,m,"Hey, Soul Sister by Train",
With You,Chris Brown,Espen Lind,m,2008,,m,With You by Chris Brown,
Body Bumpin' Yippie-Yi-Yo,Public Announcement,Euclid Gray,m,1998,,m,Body Bumpin' Yippie-Yi-Yo by Public Announcement,
A Thousand Stars,Kathy Young With The Innocents,Eugene Pearson,m,1960,,m;f,A Thousand Stars by Kathy Young With The Innocents,
My True Story,The Jive Five With Joe Rene And Orchestra,Eugene Pitt,m,1961,,m,My True Story by The Jive Five With Joe Rene And Orchestra,
Crazy In Love,Beyonce Featuring Jay Z,Eugene Record,m,2003,,m;f,Crazy In Love by Beyonce Featuring Jay Z,
Have You Seen Her,The Chi-lites,Eugene Record,m,1971,,m,Have You Seen Her by The Chi-lites,
Oh Girl,The Chi-lites,Eugene Record,m,1972,,m,Oh Girl by The Chi-lites,
Soulful Strut,Young-Holt Unlimited,Eugene Record,m,1969,,m,Soulful Strut by Young-Holt Unlimited,
Tryin' To Live My Life Without You,Bob Seger,Eugene Williams,m,1981,,m,Tryin' To Live My Life Without You by Bob Seger,
Celebration,Kool & The Gang,Eumir Deodato,m,1981,,m,Celebration by Kool & The Gang,
P.A.S.S.I.O.N.,Rhythm Syndicate,Evan Rogers,m,1991,,m,P.A.S.S.I.O.N. by Rhythm Syndicate,
Soldier Of Love,Donny Osmond,Evan Rogers,m,1989,,m,Soldier Of Love by Donny Osmond,
I Love A Rainy Night,Eddie Rabbitt,Even Stevens,m,1981,,m,I Love A Rainy Night by Eddie Rabbitt,
Rock Me Amadeus,Falco,F.Bolland,m,1986,,m,Rock Me Amadeus by Falco,
More Than Words Can Say,Alias,F.Curci,m,1990,,m,More Than Words Can Say by Alias,
Angel Eyes,The Jeff Healey Band,F.Koller,m,1989,,m,Angel Eyes by The Jeff Healey Band,
"In The Still Of The Nite (From \The Jacksons\"")""",Boyz II Men,F.Parris,m,1992,,m,"In The Still Of The Nite (From \The Jacksons\"")"" by Boyz II Men",
Where Do You Go,No Mercy,F.Reuther,m,1996,,m,Where Do You Go by No Mercy,
Burning Heart,Survivor,F.Sullivan,m,1986,,m,Burning Heart by Survivor,
The Search Is Over,Survivor,F.Sullivan,m,1985,,m,The Search Is Over by Survivor,
Do Anything,Natural Selection,F.Thomas,m,1991,,m,Do Anything by Natural Selection,
Laffy Taffy,D4L,Fabo,m,2005,,m,Laffy Taffy by D4L,
Bartender,T-Pain Featuring Akon,"Faheem Rasheed \T-Pain\"" Najm""",m,2007,,m,Bartender by T-Pain Featuring Akon,
Blame It,Jamie Foxx Featuring T-Pain,"Faheem Rasheed \T-Pain\"" Najm""",m,2009,,m,Blame It by Jamie Foxx Featuring T-Pain,
Buy U A Drank (Shawty Snappin'),T-Pain Featuring Yung Joc,"Faheem Rasheed \T-Pain\"" Najm""",m,2007,,m,Buy U A Drank (Shawty Snappin') by T-Pain Featuring Yung Joc,
I'm N Luv (Wit A Stripper),T-Pain Featuring Mike Jones,"Faheem Rasheed \T-Pain\"" Najm""",m,2006,,m,I'm N Luv (Wit A Stripper) by T-Pain Featuring Mike Jones,
Kiss Kiss,Chris Brown Featuring T-Pain,"Faheem Rasheed \T-Pain\"" Najm""",m,2007,,m,Kiss Kiss by Chris Brown Featuring T-Pain,
Low,Flo Rida Featuring T-Pain,"Faheem Rasheed \T-Pain\"" Najm""",m,2007,,m,Low by Flo Rida Featuring T-Pain,
Groove Is In The Heart,Deee-Lite,FAREED KAMAAL IBN JOHN,m,1990,,m;f,Groove Is In The Heart by Deee-Lite,
All Or Nothing,Milli Vanilli,Farian,m,1990,,m,All Or Nothing by Milli Vanilli,
Baby Don't Forget My Number,Milli Vanilli,Farian,m,1989,,m,Baby Don't Forget My Number by Milli Vanilli,
Girl I'm Gonna Miss You,Milli Vanilli,Farian,m,1989,,m,Girl I'm Gonna Miss You by Milli Vanilli,
A Beautiful Morning,The Rascals,Felix Cavaliere,m,1968,,m,A Beautiful Morning by The Rascals,
Groovin',The Young Rascals,Felix Cavaliere,m,1967,,m,Groovin' by The Young Rascals,
How Can I Be Sure,The Young Rascals,Felix Cavaliere,m,1967,,m,How Can I Be Sure by The Young Rascals,
People Got To Be Free,The Rascals,Felix Cavaliere,m,1968,,m,People Got To Be Free by The Rascals,
2 Legit 2 Quit,M.C. Hammer,Felton C.Pilate II,m,1992,,m,2 Legit 2 Quit by M.C. Hammer,
Nobody,Keith Sweat Featuring Athena Cage,Fitzgerald Scott,m,1996,,m;f,Nobody by Keith Sweat Featuring Athena Cage,
Butterfly,Crazy Town,Flea,m,2001,,m,Butterfly by Crazy Town,
Under The Bridge,Red Hot Chili Peppers,Flea,m,1992,,m,Under The Bridge by Red Hot Chili Peppers,
Wait For U,Future Featuring Drake & Tems,FLOYD E III BENTLEY,m,2022,,m;f,Wait For U by Future Featuring Drake & Tems,
4 Minutes,Madonna Featuring Justin Timberlake & Timbaland,"Floyd Nathaniel \Danja/Danjahandz\""  Hills""",m,2008,,m;f,4 Minutes by Madonna Featuring Justin Timberlake & Timbaland,
Ayo Technology,50 Cent Featuring Justin Timberlake & Timbaland,"Floyd Nathaniel \Danja/Danjahandz\""  Hills""",m,2007,,m,Ayo Technology by 50 Cent Featuring Justin Timberlake & Timbaland,
Give It To Me,Timbaland Featuring Nelly Furtado & Justin Timberlake,"Floyd Nathaniel \Danja/Danjahandz\""  Hills""",m,2007,,m;f,Give It To Me by Timbaland Featuring Nelly Furtado & Justin Timberlake,
Knock You Down,Keri Hilson Featuring Kanye West & Ne-Yo,"Floyd Nathaniel \Danja/Danjahandz\""  Hills""",m,2009,,m;f,Knock You Down by Keri Hilson Featuring Kanye West & Ne-Yo,
My Love,Justin Timberlake Featuring T.I.,"Floyd Nathaniel \Danja/Danjahandz\""  Hills""",m,2006,,m,My Love by Justin Timberlake Featuring T.I.,
Promiscuous,Nelly Furtado Featuring Timbaland,"Floyd Nathaniel \Danja/Danjahandz\""  Hills""",m,2006,,m;f,Promiscuous by Nelly Furtado Featuring Timbaland,
SexyBack,Justin Timberlake,"Floyd Nathaniel \Danja/Danjahandz\""  Hills""",m,2006,,m,SexyBack by Justin Timberlake,
The Way I Are,Timbaland Featuring Keri Hilson,"Floyd Nathaniel \Danja/Danjahandz\""  Hills""",m,2007,,m;f,The Way I Are by Timbaland Featuring Keri Hilson,
What Goes Around...Comes Around,Justin Timberlake,"Floyd Nathaniel \Danja/Danjahandz\""  Hills""",m,2007,,m,What Goes Around...Comes Around by Justin Timberlake,
Last Night,Mar-Keys,Floyd Newman,m,1961,,m,Last Night by Mar-Keys,
ABC,Jackson 5,Fonce Mizell,m,1970,,m,ABC by Jackson 5,
I Want You Back,Jackson 5,Fonce Mizell,m,1970,,m,I Want You Back by Jackson 5,
The Love You Save/I Found That Girl,Jackson 5,Fonce Mizell,m,1970,,m,The Love You Save/I Found That Girl by Jackson 5,
Nel Blu Dipinto Di Blu (Volar辿),Domenico Modugno,Franco Migliacci,m,1958,,m,Nel Blu Dipinto Di Blu (Volar辿) by Domenico Modugno,
Silhouettes,Herman's Hermits,Frank C. Slay Jr.,m,1965,,m,Silhouettes by Herman's Hermits,
Circles,Post Malone,Frank Dukes,m,2019,,m,Circles by Post Malone,
Boogie Down,Eddie Kendricks,Frank E. Wilson,m,1974,,m,Boogie Down by Eddie Kendricks,
You've Made Me So Very Happy,"Blood, Sweat & Tears",Frank E. Wilson,m,1969,,m,"You've Made Me So Very Happy by Blood, Sweat & Tears",
If You Wanna Be Happy,Jimmy Soul,Frank Guida,m,1963,,m,If You Wanna Be Happy by Jimmy Soul,
Quarter To Three,U.S. Bonds,Frank J. Guida,m,1961,,m,Quarter To Three by U.S. Bonds,
I Swear,All-4-One,Frank J. Myers,m,1994,,m,I Swear by All-4-One,
Ride Captain Ride,Blues Image,Frank Konte,m,1970,,m,Ride Captain Ride by Blues Image,
Greenfields,The Brothers Four,Frank Miller,m,1960,,m,Greenfields by The Brothers Four,
Every Woman In The World,Air Supply,FRANK MUSKER,m,1981,,m,Every Woman In The World by Air Supply,
Keep On Truckin' (Part 1),Eddie Kendricks,Frank Wilson,m,1973,,m,Keep On Truckin' (Part 1) by Eddie Kendricks,
(I've Had) The Time Of My Life,Bill Medley & Jennifer Warnes,Franke Previte,m,1987,,m;f,(I've Had) The Time Of My Life by Bill Medley & Jennifer Warnes,
"Hungry Eyes (From \Dirty Dancing\"")""",Eric Carmen,Franke Previte,m,1988,,m,"Hungry Eyes (From \Dirty Dancing\"")"" by Eric Carmen",
The Time (Dirty Bit),The Black Eyed Peas,Franke Previte,m,2010,,m;f,The Time (Dirty Bit) by The Black Eyed Peas,
I Need A Girl (Part Two),"P. Diddy & Ginuwine Featuring Loon, Mario Winans & Tammy Ruggeri",Frankie Romano,m,2002,,m;f,"I Need A Girl (Part Two) by P. Diddy & Ginuwine Featuring Loon, Mario Winans & Tammy Ruggeri",
Just A Dream,Nelly,Frankie Romano,m,2010,,m,Just A Dream by Nelly,
Eye Of The Tiger,Survivor,Frankie Sullivan,m,1982,,m,Eye Of The Tiger by Survivor,
