title,artist_name,writer,gender,year,writer_is_artist,artist_gender,title_artist_name,Songwriter is Artist
Wild Ones,Flo Rida Featuring Sia,Sia Kate Isobelle Furler,f,2012,,m;f,Wild Ones by Flo Rida Featuring Sia,1
Kill Bill,SZA,SOLANA I ROWE,f,2022,,f,Kill Bill by SZA,1
Kiss Me More,Doja Cat Featuring SZA,SOLANA I ROWE,f,2021,,f,Kiss Me More by Doja Cat Featuring SZA,1
Damn I Wish I Was Your Lover,Sophie B. Hawkins,Sophie B. Hawkins,f,1992,,f,Damn I Wish I Was Your Lover by Sophie B. Hawkins,1
2 Become 1,Spice Girls,Spice Girls,f,1997,,f,2 Become 1 by Spice Girls,1
Say You'll Be There,Spice Girls,Spice Girls,f,1997,,f,Say You'll Be There by Spice Girls,1
Wannabe,Spice Girls,Spice Girls,f,1997,,f,Wannabe by Spice Girls,1
Big Girls Don't Cry,Fergie,"Stacy \Fergie\"" Ferguson Duhamel""",f,2007,,f,Big Girls Don't Cry by Fergie,1
Boom Boom Pow,The Black Eyed Peas,"Stacy \Fergie\"" Ferguson Duhamel""",f,2009,,m;f,Boom Boom Pow by The Black Eyed Peas,1
Clumsy,Fergie,"Stacy \Fergie\"" Ferguson Duhamel""",f,2007,,f,Clumsy by Fergie,1
Fergalicious,Fergie,"Stacy \Fergie\"" Ferguson Duhamel""",f,2006,,f,Fergalicious by Fergie,1
Glamorous,Fergie Featuring Ludacris,"Stacy \Fergie\"" Ferguson Duhamel""",f,2007,,m;f,Glamorous by Fergie Featuring Ludacris,1
I Gotta Feeling,The Black Eyed Peas,"Stacy \Fergie\"" Ferguson Duhamel""",f,2009,,m;f,I Gotta Feeling by The Black Eyed Peas,1
Imma Be,The Black Eyed Peas,"Stacy \Fergie\"" Ferguson Duhamel""",f,2010,,m;f,Imma Be by The Black Eyed Peas,1
Just Can't Get Enough,The Black Eyed Peas,"Stacy \Fergie\"" Ferguson Duhamel""",f,2011,,m;f,Just Can't Get Enough by The Black Eyed Peas,1
London Bridge,Fergie,"Stacy \Fergie\"" Ferguson Duhamel""",f,2006,,f,London Bridge by Fergie,1
Alejandro,Lady Gaga,"Stefani Gabriella \Lady Gaga\"" Germanotta""",f,2010,,f,Alejandro by Lady Gaga,1
Applause,Lady Gaga,"Stefani Gabriella \Lady Gaga\"" Germanotta""",f,2013,,f,Applause by Lady Gaga,1
Bad Romance,Lady Gaga,"Stefani Gabriella \Lady Gaga\"" Germanotta""",f,2009,,f,Bad Romance by Lady Gaga,1
Born This Way,Lady Gaga,"Stefani Gabriella \Lady Gaga\"" Germanotta""",f,2011,,f,Born This Way by Lady Gaga,1
Just Dance,Lady Gaga Featuring Colby O'Donis,"Stefani Gabriella \Lady Gaga\"" Germanotta""",f,2008,,m;f,Just Dance by Lady Gaga Featuring Colby O'Donis,1
LoveGame,Lady Gaga,"Stefani Gabriella \Lady Gaga\"" Germanotta""",f,2009,,f,LoveGame by Lady Gaga,1
Poker Face,Lady Gaga,"Stefani Gabriella \Lady Gaga\"" Germanotta""",f,2009,,f,Poker Face by Lady Gaga,1
Million Reasons,Lady Gaga,"Stefani Gabriella \Lady Gaga\"" Germanotta""",f,2017,,f,Million Reasons by Lady Gaga,1
Telephone,Lady Gaga Featuring Beyonce,"Stefani Gabriella \Lady Gaga\"" Germanotta""",f,2010,,f,Telephone by Lady Gaga Featuring Beyonce,1
The Edge Of Glory,Lady Gaga,"Stefani Gabriella \Lady Gaga\"" Germanotta""",f,2011,,f,The Edge Of Glory by Lady Gaga,1
Stupid Love,Lady Gaga,STEFANI GERMANOTTA,f,2020,,f,Stupid Love by Lady Gaga,1
Stand Back,Stevie Nicks,STEPHANIE NICKS,f,1983,,f,Stand Back by Stevie Nicks,1
Dreams,Fleetwood Mac,Stevie Nicks,f,1977,,m;f,Dreams by Fleetwood Mac,1
Luka,Suzanne Vega,Suzanne Vega,f,1987,,f,Luka by Suzanne Vega,1
Tom's Diner,DNA Featuring Suzanne Vega,Suzanne Vega,f,1990,,m;f,Tom's Diner by DNA Featuring Suzanne Vega,1
Pillow Talk,Sylvia (r&b),Sylvia Robinson,f,1973,,f,Pillow Talk by Sylvia (r&b),1
Rhythm Is A Dancer,Snap!,T.Austin,f,1993,,m;f,Rhythm Is A Dancer by Snap!,1
My Love Is The Shhh!,Somethin' For The People Featuring Trina & Tamara,Tamara Powell,f,1997,,m;f,My Love Is The Shhh! by Somethin' For The People Featuring Trina & Tamara,1
Into You,Fabolous Featuring Tamia Or Ashanti,Tamia Washington Hill,f,2003,,m;f,Into You by Fabolous Featuring Tamia Or Ashanti,1
The 1,Taylor Swift,TAYLOR A SWIFT,f,2020,,f,The 1 by Taylor Swift,1
All Too Well (Taylor's Version),Taylor Swift,TAYLOR ALISON SWIFT,f,2021,,f,All Too Well (Taylor's Version) by Taylor Swift,1
ME!,Taylor Swift Featuring Brendon Urie,TAYLOR ALISON SWIFT,f,2019,,m;f,ME! by Taylor Swift Featuring Brendon Urie,1
You Need To Calm Down,Taylor Swift,TAYLOR ALISON SWIFT,f,2019,,f,You Need To Calm Down by Taylor Swift,1
abcdefu,GAYLE,TAYLOR GAYLE RUTHERFURD,f,2022,,f,abcdefu by GAYLE,1
Bad Blood,Taylor Swift Featuring Kendrick Lamar,Taylor Swift,f,2015,,m;f,Bad Blood by Taylor Swift Featuring Kendrick Lamar,1
Blank Space,Taylor Swift,Taylor Swift,f,2014,,f,Blank Space by Taylor Swift,1
I Knew You Were Trouble.,Taylor Swift,Taylor Swift,f,2012,,f,I Knew You Were Trouble. by Taylor Swift,1
Love Story,Taylor Swift,Taylor Swift,f,2008,,f,Love Story by Taylor Swift,1
Mine,Taylor Swift,Taylor Swift,f,2010,,f,Mine by Taylor Swift,1
Shake It Off,Taylor Swift,Taylor Swift,f,2014,,f,Shake It Off by Taylor Swift,1
...Ready For It?,Taylor Swift,Taylor Swift,f,2017,,f,...Ready For It? by Taylor Swift,1
Anti-Hero,Taylor Swift,TAYLOR SWIFT,f,2022,,f,Anti-Hero by Taylor Swift,1
Cardigan,Taylor Swift,Taylor Swift,f,2020,,f,Cardigan by Taylor Swift,1
I Don't Wanna Live Forever (Fifty Shades Darker),Zayn / Taylor Swift,Taylor Swift,f,2017,,m;f,I Don't Wanna Live Forever (Fifty Shades Darker) by Zayn / Taylor Swift,1
Lavender Haze,Taylor Swift,TAYLOR SWIFT,f,2022,,f,Lavender Haze by Taylor Swift,1
Look What You Made Me Do,Taylor Swift,Taylor Swift,f,2017,,f,Look What You Made Me Do by Taylor Swift,1
Maroon,Taylor Swift,TAYLOR SWIFT,f,2022,,f,Maroon by Taylor Swift,1
Today Was A Fairytale,Taylor Swift,Taylor Swift,f,2010,,f,Today Was A Fairytale by Taylor Swift,1
Midnight Rain,Taylor Swift,TAYLOR SWIFT,f,2022,,f,Midnight Rain by Taylor Swift,1
Snow On The Beach,Taylor Swift Featuring Lana Del Rey,TAYLOR SWIFT,f,2022,,f,Snow On The Beach by Taylor Swift Featuring Lana Del Rey,1
Willow,Taylor Swift,Taylor Swift,f,2020,,f,Willow by Taylor Swift,1
We Are Never Ever Getting Back Together,Taylor Swift,Taylor Swift,f,2012,,f,We Are Never Ever Getting Back Together by Taylor Swift,1
Wildest Dreams,Taylor Swift,Taylor Swift,f,2015,,f,Wildest Dreams by Taylor Swift,1
You Belong With Me,Taylor Swift,Taylor Swift,f,2009,,f,You Belong With Me by Taylor Swift,1
Lover Girl,Teena Marie,Teena Marie,f,1985,,f,Lover Girl by Teena Marie,1
Wait For U,Future Featuring Drake & Tems,TEMILADE ANNA OPENIYI,f,2022,,m;f,Wait For U by Future Featuring Drake & Tems,1
Unpretty,TLC,Tionne Watkins,f,1999,,f,Unpretty by TLC,1
Do That To Me One More Time,Captain & Tennille,Toni Tennille,f,1980,,m;f,Do That To Me One More Time by Captain & Tennille,1
The Way I Want To Touch You,Captain & Tennille,Toni Tennille,f,1975,,m;f,The Way I Want To Touch You by Captain & Tennille,1
Dance Monkey,Tones And I,Toni Watson,f,2020,,f,Dance Monkey by Tones And I,1
Who Dat,JT Money Featuring Sole,Tonya Johnston,f,1999,,m;f,Who Dat by JT Money Featuring Sole,1
Missing,Everything But The Girl,Tracey Thorn,f,1996,,m;f,Missing by Everything But The Girl,1
Give Me One Reason,Tracy Chapman,Tracy L. Chapman,f,1996,,f,Give Me One Reason by Tracy Chapman,1
A Thousand Miles,Vanessa Carlton,Vanessa Carlton,f,2002,,f,A Thousand Miles by Vanessa Carlton,1
Hold Me,Fleetwood Mac,VIE CHRISTINE MC,f,1982,,m;f,Hold Me by Fleetwood Mac,1
Hold On,Wilson Phillips,Wilson,f,1990,,f,Hold On by Wilson Phillips,1
Release Me,Wilson Phillips,Wilson Phillips,f,1990,,f,Release Me by Wilson Phillips,1
You're In Love,Wilson Phillips,Wilson Phillips,f,1991,,f,You're In Love by Wilson Phillips,1
"I Heard A Rumour (From \Disorderlies\"")""",Bananarama,Woodward,f,1987,,f,"I Heard A Rumour (From \Disorderlies\"")"" by Bananarama",1
Let Me In,The Sensations,Yvonne Baker,f,1962,,m;f,Let Me In by The Sensations,1
Mood,24kGoldn Featuring iann dior,24kGoldn,m,2020,,m,Mood by 24kGoldn Featuring iann dior,1
Trollz,6ix9ine & Nicki Minaj,6ix9ine,m,2020,,m;f,Trollz by 6ix9ine & Nicki Minaj,1
Stranger On The Shore,Mr. Acker Bilk,Acker Bilk,m,1962,,m,Stranger On The Shore by Mr. Acker Bilk,1
I'm Still In Love With You,Al Green,Al Green,m,1972,,m,I'm Still In Love With You by Al Green,1
Let's Stay Together,Al Green,Al Green,m,1972,,m,Let's Stay Together by Al Green,1
Look What You Done For Me,Al Green,Al Green,m,1972,,m,Look What You Done For Me by Al Green,1
You Ought To Be With Me,Al Green,Al Green,m,1972,,m,You Ought To Be With Me by Al Green,1
Undercover Angel,Alan O'Day,Alan O'Day,m,1977,,m,Undercover Angel by Alan O'Day,1
Eye In The Sky,The Alan Parsons Project,ALAN PARSONS,m,1982,,m,Eye In The Sky by The Alan Parsons Project,1
It Never Rains In Southern California,Albert Hammond,Albert Hammond,m,1972,,m,It Never Rains In Southern California by Albert Hammond,1
Air Force Ones,"Nelly Featuring Kyjuan, Ali & Murphy Lee",Ali,m,2002,,m,"Air Force Ones by Nelly Featuring Kyjuan, Ali & Murphy Lee",1
Grillz,"Nelly Featuring Paul Wall, Ali & Gipp",Ali,m,2005,,m,"Grillz by Nelly Featuring Paul Wall, Ali & Gipp",1
(Love Is) Thicker Than Water,Andy Gibb,Andy Gibb,m,1978,,m,(Love Is) Thicker Than Water by Andy Gibb,1
Shadow Dancing,Andy Gibb,Andy Gibb,m,1978,,m,Shadow Dancing by Andy Gibb,1
Rock Me Gently,Andy Kim,Andy Kim,m,1974,,m,Rock Me Gently by Andy Kim,1
Tighten Up,Archie Bell & The Drells,Archie Bell,m,1968,,m,Tighten Up by Archie Bell & The Drells,1
Roxanne,Arizona Zervas,ARIZONA ZERVAS,m,2019,,m,Roxanne by Arizona Zervas,1
Fire,The Crazy World Of Arthur Brown,Arthur Brown,m,1968,,m,Fire by The Crazy World Of Arthur Brown,1
Sweet Soul Music,Arthur Conley,Arthur Conley,m,1967,,m,Sweet Soul Music by Arthur Conley,1
"Can't Get Enough Of Your Love, Babe",Barry White,Barry White,m,1974,,m,"Can't Get Enough Of Your Love, Babe by Barry White",1
I'm Gonna Love You Just A Little More Baby,Barry White,Barry White,m,1973,,m,I'm Gonna Love You Just A Little More Baby by Barry White,1
"You're The First, The Last, My Everything",Barry White,Barry White,m,1974,,m,"You're The First, The Last, My Everything by Barry White",1
Gonna Fly Now,Bill Conti,Bill Conti,m,1977,,m,Gonna Fly Now by Bill Conti,1
The All American Boy,Bill Parsons,Bill Parsons,m,1959,,m,The All American Boy by Bill Parsons,1
Ain't No Sunshine,Bill Withers,Bill Withers,m,1971,,m,Ain't No Sunshine by Bill Withers,1
Lean On Me,Bill Withers,Bill Withers,m,1972,,m,Lean On Me by Bill Withers,1
Use Me,Bill Withers,Bill Withers,m,1972,,m,Use Me by Bill Withers,1
"Cradle Of Love (From \Ford Fairlane\"")""",Billy Idol,Billy Idol,m,1990,,m,"Cradle Of Love (From \Ford Fairlane\"")"" by Billy Idol",1
It's Still Rock And Roll To Me,Billy Joel,Billy Joel,m,1980,,m,It's Still Rock And Roll To Me by Billy Joel,1
Just The Way You Are,Billy Joel,Billy Joel,m,1978,,m,Just The Way You Are by Billy Joel,1
My Life,Billy Joel,Billy Joel,m,1978,,m,My Life by Billy Joel,1
Caribbean Queen (No More Love On The Run),Billy Ocean,Billy Ocean,m,1984,,m,Caribbean Queen (No More Love On The Run) by Billy Ocean,1
"Get Outta My Dreams, Get Into My Car",Billy Ocean,Billy Ocean,m,1988,,m,"Get Outta My Dreams, Get Into My Car by Billy Ocean",1
Lover Boy,Billy Ocean,Billy Ocean,m,1985,,m,Lover Boy by Billy Ocean,1
There'll Be Sad Songs (To Make You Cry),Billy Ocean,Billy Ocean,m,1986,,m,There'll Be Sad Songs (To Make You Cry) by Billy Ocean,1
"When The Going Gets Tough, The Tough Get Going",Billy Ocean,Billy Ocean,m,1986,,m,"When The Going Gets Tough, The Tough Get Going by Billy Ocean",1
Nothing From Nothing,Billy Preston,Billy Preston,m,1974,,m,Nothing From Nothing by Billy Preston,1
Outa-Space,Billy Preston,Billy Preston,m,1972,,m,Outa-Space by Billy Preston,1
Space Race,Billy Preston,Billy Preston,m,1973,,m,Space Race by Billy Preston,1
Will It Go Round In Circles,Billy Preston,Billy Preston,m,1973,,m,Will It Go Round In Circles by Billy Preston,1
Like A Rolling Stone,Bob Dylan,Bob Dylan,m,1965,,m,Like A Rolling Stone by Bob Dylan,1
Rainy Day Women #12 & 35,Bob Dylan,Bob Dylan,m,1966,,m,Rainy Day Women #12 & 35 by Bob Dylan,1
Elusive Butterfly,Bob Lind,Bob Lind,m,1966,,m,Elusive Butterfly by Bob Lind,1
Against The Wind,Bob Seger,Bob Seger,m,1980,,m,Against The Wind by Bob Seger,1
Night Moves,Bob Seger,Bob Seger,m,1977,,m,Night Moves by Bob Seger,1
Still The Same,Bob Seger & The Silver Bullet Band,Bob Seger,m,1978,,m,Still The Same by Bob Seger & The Silver Bullet Band,1
Humpin' Around,Bobby Brown,Bobby Brown,m,1992,,m,Humpin' Around by Bobby Brown,1
My Prerogative,Bobby Brown,Bobby Brown,m,1988,,m,My Prerogative by Bobby Brown,1
She Ain't Worth It,Glenn Medeiros Featuring Bobby Brown,Bobby Brown,m,1990,,m,She Ain't Worth It by Glenn Medeiros Featuring Bobby Brown,1
Dream Lover,Bobby Darin,Bobby Darin,m,1959,,m,Dream Lover by Bobby Darin,1
Splish Splash,Bobby Darin,Bobby Darin,m,1958,,m,Splish Splash by Bobby Darin,1
Things,Bobby Darin,Bobby Darin,m,1962,,m,Things by Bobby Darin,1
You're The Reason I'm Living,Bobby Darin,Bobby Darin,m,1963,,m,You're The Reason I'm Living by Bobby Darin,1
Sunny,Bobby Hebb,Bobby Hebb,m,1966,,m,Sunny by Bobby Hebb,1
Mr. Lonely,Bobby Vinton,Bobby Vinton,m,1964,,m,Mr. Lonely by Bobby Vinton,1
My Melody Of Love,Bobby Vinton,Bobby Vinton,m,1974,,m,My Melody Of Love by Bobby Vinton,1
"Look Into My Eyes (From \Batman & Robin\"")""",Bone Thugs-N-Harmony,Bone,m,1997,,m,"Look Into My Eyes (From \Batman & Robin\"")"" by Bone Thugs-N-Harmony",1
Tha Crossroads,Bone Thugs-N-Harmony,Bone,m,1996,,m,Tha Crossroads by Bone Thugs-N-Harmony,1
Lowdown,Boz Scaggs,Boz Scaggs,m,1976,,m,Lowdown by Boz Scaggs,1
Back At One,Brian McKnight,Brian McKnight,m,1999,,m,Back At One by Brian McKnight,1
It's Just A Matter Of Time,Brook Benton,Brook Benton,m,1959,,m,It's Just A Matter Of Time by Brook Benton,1
The Boll Weevil Song,Brook Benton,Brook Benton,m,1961,,m,The Boll Weevil Song by Brook Benton,1
Hey! Baby,Bruce Channel,Bruce Channel,m,1962,,m,Hey! Baby by Bruce Channel,1
Mandolin Rain,Bruce Hornsby & The Range,Bruce Hornsby,m,1987,,m,Mandolin Rain by Bruce Hornsby & The Range,1
The Way It Is,Bruce Hornsby & The Range,Bruce Hornsby,m,1986,,m,The Way It Is by Bruce Hornsby & The Range,1
Brilliant Disguise,Bruce Springsteen,Bruce Springsteen,m,1987,,m,Brilliant Disguise by Bruce Springsteen,1
Dancing In The Dark,Bruce Springsteen,Bruce Springsteen,m,1984,,m,Dancing In The Dark by Bruce Springsteen,1
Glory Days,Bruce Springsteen,Bruce Springsteen,m,1985,,m,Glory Days by Bruce Springsteen,1
Hungry Heart,Bruce Springsteen,Bruce Springsteen,m,1980,,m,Hungry Heart by Bruce Springsteen,1
Leave The Door Open,Silk Sonic (Bruno Mars & Anderson .Paak),Bruno Mars,m,2021,,m,Leave The Door Open by Silk Sonic (Bruno Mars & Anderson .Paak),1
(Everything I Do) I Do It For You,Bryan Adams,Bryan Adams,m,1991,,m,(Everything I Do) I Do It For You by Bryan Adams,1
All For Love,Bryan Adams/Rod Stewart/Sting,Bryan Adams,m,1993,,m,All For Love by Bryan Adams/Rod Stewart/Sting,1
Can't Stop This Thing We Started,Bryan Adams,Bryan Adams,m,1991,,m,Can't Stop This Thing We Started by Bryan Adams,1
Have You Ever Really Loved A Woman?,Bryan Adams,Bryan Adams,m,1995,,m,Have You Ever Really Loved A Woman? by Bryan Adams,1
Heaven,Bryan Adams,Bryan Adams,m,1985,,m,Heaven by Bryan Adams,1
Summer Of '69,Bryan Adams,Bryan Adams,m,1985,,m,Summer Of '69 by Bryan Adams,1
Wild Thoughts,DJ Khaled Featuring Rihanna & Bryson Tiller,Bryson Tiller,m,2017,,m;f,Wild Thoughts by DJ Khaled Featuring Rihanna & Bryson Tiller,1
Convoy,C.W. McCall,C.W. McCall,m,1976,,m,Convoy by C.W. McCall,1
Kung Fu Fighting,Carl Douglas,Carl Douglas,m,1974,,m,Kung Fu Fighting by Carl Douglas,1
Hero,Chad Kroeger Featuring Josey Scott,Chad Kroeger,m,2002,,m,Hero by Chad Kroeger Featuring Josey Scott,1
The Devil Went Down To Georgia,The Charlie Daniels Band,Charlie Daniels,m,1979,,m,The Devil Went Down To Georgia by The Charlie Daniels Band,1
"I Like It Like That, Part 1",Chris Kenner,Chris Kenner,m,1961,,m,"I Like It Like That, Part 1 by Chris Kenner",1
Arthur's Theme (Best That You Can Do),Christopher Cross,Christopher Cross,m,1981,,m,Arthur's Theme (Best That You Can Do) by Christopher Cross,1
Sailing,Christopher Cross,Christopher Cross,m,1980,,m,Sailing by Christopher Cross,1
Feels So Good,Chuck Mangione,Chuck Mangione,m,1978,,m,Feels So Good by Chuck Mangione,1
I Adore Mi Amor,Color Me Badd,Color Me Badd,m,1991,,m,I Adore Mi Amor by Color Me Badd,1
It's Only Make Believe,Conway Twitty,Conway Twitty,m,1958,,m,It's Only Make Believe by Conway Twitty,1
Never Surrender,Corey Hart,Corey Hart,m,1985,,m,Never Surrender by Corey Hart,1
Topsy II,Cozy Cole,Cozy Cole,m,1958,,m,Topsy II by Cozy Cole,1
Miss Me Blind,Culture Club,Culture Club,m,1984,,m,Miss Me Blind by Culture Club,1
"Freddie's Dead (Theme From \Superfly\"")""",Curtis Mayfield,Curtis Mayfield,m,1972,,m,"Freddie's Dead (Theme From \Superfly\"")"" by Curtis Mayfield",1
Rockstar,DaBaby Featuring Roddy Ricch,DaBaby,m,2020,,m,Rockstar by DaBaby Featuring Roddy Ricch,1
Sometimes When We Touch,Dan Hill,Dan Hill,m,1978,,m,Sometimes When We Touch by Dan Hill,1
Bad Day,Daniel Powter,Daniel Powter,m,2006,,m,Bad Day by Daniel Powter,1
Dreamtime,Daryl Hall,Daryl Hall,m,1986,,m,Dreamtime by Daryl Hall,1
Everything Your Heart Desires,Daryl Hall John Oates,Daryl Hall,m,1988,,m,Everything Your Heart Desires by Daryl Hall John Oates,1
I Can't Go For That (No Can Do),Daryl Hall John Oates,Daryl Hall,m,1981,,m,I Can't Go For That (No Can Do) by Daryl Hall John Oates,1
Kiss On My List,Daryl Hall John Oates,Daryl Hall,m,1981,,m,Kiss On My List by Daryl Hall John Oates,1
Maneater,Daryl Hall John Oates,Daryl Hall,m,1982,,m,Maneater by Daryl Hall John Oates,1
Method Of Modern Love,Daryl Hall John Oates,Daryl Hall,m,1985,,m,Method Of Modern Love by Daryl Hall John Oates,1
Out Of Touch,Daryl Hall John Oates,Daryl Hall,m,1984,,m,Out Of Touch by Daryl Hall John Oates,1
Private Eyes,Daryl Hall John Oates,Daryl Hall,m,1981,,m,Private Eyes by Daryl Hall John Oates,1
Rich Girl,Daryl Hall John Oates,Daryl Hall,m,1977,,m,Rich Girl by Daryl Hall John Oates,1
Sara Smile,Daryl Hall John Oates,Daryl Hall,m,1976,,m,Sara Smile by Daryl Hall John Oates,1
Say It Isn't So,Daryl Hall John Oates,Daryl Hall,m,1983,,m,Say It Isn't So by Daryl Hall John Oates,1
The Happy Organ,"Dave \Baby\"" Cortez""","Dave \Baby\"" Cortez""",m,1959,,m,"The Happy Organ by Dave \Baby\"" Cortez""",1
Because,The Dave Clark Five,Dave Clark,m,1964,,m,Because by The Dave Clark Five,1
Bits And Pieces,The Dave Clark Five,Dave Clark,m,1964,,m,Bits And Pieces by The Dave Clark Five,1
Can't You See That She's Mine,The Dave Clark Five,Dave Clark,m,1964,,m,Can't You See That She's Mine by The Dave Clark Five,1
Catch Us If You Can,The Dave Clark Five,Dave Clark,m,1965,,m,Catch Us If You Can by The Dave Clark Five,1
Please Come To Boston,Dave Loggins,Dave Loggins,m,1974,,m,Please Come To Boston by Dave Loggins,1
Fame,David Bowie,David Bowie,m,1975,,m,Fame by David Bowie,1
Let's Dance,David Bowie,David Bowie,m,1983,,m,Let's Dance by David Bowie,1
Rock On,David Essex,David Essex,m,1974,,m,Rock On by David Essex,1
Sexy Chick,David Guetta Featuring Akon,David Guetta,m,2010,,m,Sexy Chick by David Guetta Featuring Akon,1
Turn Me On,David Guetta Featuring Nicki Minaj,David Guetta,m,2012,,m;f,Turn Me On by David Guetta Featuring Nicki Minaj,1
Without You,David Guetta Featuring Usher,David Guetta,m,2011,,m,Without You by David Guetta Featuring Usher,1
The Stripper,David Rose and His Orchestra,David Rose,m,1962,,m,The Stripper by David Rose and His Orchestra,1
Alvin's Harmonica,David Seville And The Chipmunks,David Seville,m,1959,,m,Alvin's Harmonica by David Seville And The Chipmunks,1
Raindrops,Dee Clark,Dee Clark,m,1961,,m,Raindrops by Dee Clark,1
Runaway,Del Shannon,Del Shannon,m,1961,,m,Runaway by Del Shannon,1
Mr. Jaws,Dickie Goodman,Dickie Goodman,m,1975,,m,Mr. Jaws by Dickie Goodman,1
Nel Blu Dipinto Di Blu (Volar辿),Domenico Modugno,Domenico Modugno,m,1958,,m,Nel Blu Dipinto Di Blu (Volar辿) by Domenico Modugno,1
Dirty Laundry,Don Henley,Don Henley,m,1982,,m,Dirty Laundry by Don Henley,1
The Boys Of Summer,Don Henley,Don Henley,m,1985,,m,The Boys Of Summer by Don Henley,1
American Pie (Parts I & II),Don McLean,Don McLean,m,1971,,m,American Pie (Parts I & II) by Don McLean,1
Sunshine Superman,Donovan,Donovan,m,1966,,m,Sunshine Superman by Donovan,1
In My Feelings,Drake,Drake,m,2018,,m,In My Feelings by Drake,1
Nice For What,Drake,Drake,m,2018,,m,Nice For What by Drake,1
Toosie Slide,Drake,Drake,m,2020,,m,Toosie Slide by Drake,1
What's Next,Drake,Drake,m,2021,,m,What's Next by Drake,1
A View To A Kill,Duran Duran,Duran Duran,m,1985,,m,A View To A Kill by Duran Duran,1
Ordinary World,Duran Duran,Duran Duran,m,1993,,m,Ordinary World by Duran Duran,1
The Wild Boys,Duran Duran,Duran Duran,m,1984,,m,The Wild Boys by Duran Duran,1
Union Of The Snake,Duran Duran,Duran Duran,m,1983,,m,Union Of The Snake by Duran Duran,1
Save Tonight,Eagle-Eye Cherry,Eagle-Eye Cherry,m,1999,,m,Save Tonight by Eagle-Eye Cherry,1
I Love A Rainy Night,Eddie Rabbitt,Eddie Rabbitt,m,1981,,m,I Love A Rainy Night by Eddie Rabbitt,1
Electric Avenue,Eddy Grant,Eddy Grant,m,1983,,m,Electric Avenue by Eddy Grant,1
Frankenstein,Edgar Winter Group,Edgar Winter,m,1973,,m,Frankenstein by Edgar Winter Group,1
I'll Be,Edwin McCain,Edwin McCain,m,1998,,m,I'll Be by Edwin McCain,1
Bennie And The Jets,Elton John,Elton John,m,1974,,m,Bennie And The Jets by Elton John,1
"Can You Feel The Love Tonight (From \The Lion King\"")""",Elton John,Elton John,m,1994,,m,"Can You Feel The Love Tonight (From \The Lion King\"")"" by Elton John",1
Candle In The Wind 1997/Something About The Way You Look Tonight,Elton John,Elton John,m,1997,,m,Candle In The Wind 1997/Something About The Way You Look Tonight by Elton John,1
Crocodile Rock,Elton John,Elton John,m,1973,,m,Crocodile Rock by Elton John,1
Daniel,Elton John,Elton John,m,1973,,m,Daniel by Elton John,1
Don't Go Breaking My Heart,Elton John & Kiki Dee,Elton John,m,1976,,m;f,Don't Go Breaking My Heart by Elton John & Kiki Dee,1
Don't Let The Sun Go Down On Me,Elton John,Elton John,m,1974,,m,Don't Let The Sun Go Down On Me by Elton John,1
Don't Let The Sun Go Down On Me,George Michael/Elton John,Elton John,m,1992,,m,Don't Let The Sun Go Down On Me by George Michael/Elton John,1
Goodbye Yellow Brick Road,Elton John,Elton John,m,1973,,m,Goodbye Yellow Brick Road by Elton John,1
I Don't Wanna Go On With You Like That,Elton John,Elton John,m,1988,,m,I Don't Wanna Go On With You Like That by Elton John,1
I Guess That's Why They Call It The Blues,Elton John,Elton John,m,1984,,m,I Guess That's Why They Call It The Blues by Elton John,1
Island Girl,Elton John,Elton John,m,1975,,m,Island Girl by Elton John,1
Little Jeannie,Elton John,ELTON JOHN,m,1980,,m,Little Jeannie by Elton John,1
Philadelphia Freedom,The Elton John Band,Elton John,m,1975,,m,Philadelphia Freedom by The Elton John Band,1
Sad Songs (say So Much),Elton John,Elton John,m,1984,,m,Sad Songs (say So Much) by Elton John,1
Someone Saved My Life Tonight,Elton John,Elton John,m,1975,,m,Someone Saved My Life Tonight by Elton John,1
The Bitch Is Back,Elton John,Elton John,m,1974,,m,The Bitch Is Back by Elton John,1
Fooled Around And Fell In Love,Elvin Bishop,Elvin Bishop,m,1976,,m,Fooled Around And Fell In Love by Elvin Bishop,1
All By Myself,Eric Carmen,Eric Carmen,m,1976,,m,All By Myself by Eric Carmen,1
Lay Down Sally,Eric Clapton,Eric Clapton,m,1978,,m,Lay Down Sally by Eric Clapton,1
Tears In Heaven,Eric Clapton,Eric Clapton,m,1992,,m,Tears In Heaven by Eric Clapton,1
Dueling Banjos,Deliverance/Eric Weissberg & Steve Mandell,Eric Weissberg,m,1973,,m,Dueling Banjos by Deliverance/Eric Weissberg & Steve Mandell,1
Rock Me Amadeus,Falco,Falco,m,1986,,m,Rock Me Amadeus by Falco,1
"This Ain't A Scene, It's An Arms Race",Fall Out Boy,Fall Out Boy,m,2007,,m,"This Ain't A Scene, It's An Arms Race by Fall Out Boy",1
Last Date,Floyd Cramer,Floyd Cramer,m,1960,,m,Last Date by Floyd Cramer,1
On The Rebound,Floyd Cramer,Floyd Cramer,m,1961,,m,On The Rebound by Floyd Cramer,1
Music Box Dancer,Frank Mills,Frank Mills,m,1979,,m,Music Box Dancer by Frank Mills,1
Everybody Loves A Clown,Gary Lewis And The Playboys,Gary Lewis,m,1965,,m,Everybody Loves A Clown by Gary Lewis And The Playboys,1
She's Just My Style,Gary Lewis And The Playboys,Gary Lewis,m,1966,,m,She's Just My Style by Gary Lewis And The Playboys,1
Dream Weaver,Gary Wright,Gary Wright,m,1976,,m,Dream Weaver by Gary Wright,1
Love Is Alive,Gary Wright,Gary Wright,m,1976,,m,Love Is Alive by Gary Wright,1
Duke Of Earl,Gene Chandler,Gene Chandler,m,1962,,m,Duke Of Earl by Gene Chandler,1
All Those Years Ago,George Harrison,George Harrison,m,1981,,m,All Those Years Ago by George Harrison,1
Give Me Love - (Give Me Peace On Earth),George Harrison,George Harrison,m,1973,,m,Give Me Love - (Give Me Peace On Earth) by George Harrison,1
My Sweet Lord/Isn't It A Pity,George Harrison,George Harrison,m,1970,,m,My Sweet Lord/Isn't It A Pity by George Harrison,1
Careless Whisper,Wham! Featuring George Michael,George Michael,m,1985,,m,Careless Whisper by Wham! Featuring George Michael,1
Faith,George Michael,George Michael,m,1987,,m,Faith by George Michael,1
Father Figure,George Michael,George Michael,m,1988,,m,Father Figure by George Michael,1
Heaven Help Me,Deon Estus With George Michael,George Michael,m,1989,,m,Heaven Help Me by Deon Estus With George Michael,1
"I Want Your Sex (From \Beverly Hills Cop II\"")""",George Michael,George Michael,m,1987,,m,"I Want Your Sex (From \Beverly Hills Cop II\"")"" by George Michael",1
Kissing A Fool,George Michael,George Michael,m,1988,,m,Kissing A Fool by George Michael,1
Monkey,George Michael,George Michael,m,1988,,m,Monkey by George Michael,1
One More Try,George Michael,George Michael,m,1988,,m,One More Try by George Michael,1
Praying For Time,George Michael,George Michael,m,1990,,m,Praying For Time by George Michael,1
